Dataline,Play,PlayerLinenumber,ActSceneLine,Player,PlayerLine,Act,Scene,Line,Characters
34510,Hamlet,43.0,3.2.129,HAMLET,"months ago, and not forgotten yet? Then there's",3,2,129,"['A', 'KING CLAUDIUS', 'POLONIUS', 'ROSENCRANTZ', 'OPHELIA', 'QUEEN GERTRUDE', 'HAMLET', 'GUILDENSTERN', 'Danish', 'HORATIO']"
34511,Hamlet,43.0,3.2.130,HAMLET,hope a great man's memory may outlive his life half,3,2,130,"['A', 'KING CLAUDIUS', 'POLONIUS', 'ROSENCRANTZ', 'OPHELIA', 'QUEEN GERTRUDE', 'HAMLET', 'GUILDENSTERN', 'Danish', 'HORATIO']"
34512,Hamlet,43.0,3.2.131,HAMLET,"a year: but, by'r lady, he must build churches,",3,2,131,"['A', 'KING CLAUDIUS', 'POLONIUS', 'ROSENCRANTZ', 'OPHELIA', 'QUEEN GERTRUDE', 'HAMLET', 'GUILDENSTERN', 'Danish', 'HORATIO']"
34513,Hamlet,43.0,3.2.132,HAMLET,"then, or else shall he suffer not thinking on, with",3,2,132,"['A', 'KING CLAUDIUS', 'POLONIUS', 'ROSENCRANTZ', 'OPHELIA', 'QUEEN GERTRUDE', 'HAMLET', 'GUILDENSTERN', 'Danish', 'HORATIO']"
34514,Hamlet,43.0,3.2.133,HAMLET,"the hobby-horse, whose epitaph is 'For, O, for, O,",3,2,133,"['A', 'KING CLAUDIUS', 'POLONIUS', 'ROSENCRANTZ', 'OPHELIA', 'QUEEN GERTRUDE', 'HAMLET', 'GUILDENSTERN', 'Danish', 'HORATIO']"
34515,Hamlet,43.0,3.2.134,HAMLET,the hobby-horse is forgot.',3,2,134,"['A', 'KING CLAUDIUS', 'POLONIUS', 'ROSENCRANTZ', 'OPHELIA', 'QUEEN GERTRUDE', 'HAMLET', 'GUILDENSTERN', 'Danish', 'HORATIO']"
34519,Hamlet,44.0,3.2.135,OPHELIA,"What means this, my lord?",3,2,135,[]
34520,Hamlet,45.0,3.2.136,HAMLET,"Marry, this is miching mallecho, it means mischief.",3,2,136,[]
34521,Hamlet,46.0,3.2.137,OPHELIA,Belike this show imports the argument of the play.,3,2,137,[]
34523,Hamlet,47.0,3.2.138,HAMLET,We shall know by this fellow: the players cannot,3,2,138,['Prologue']
34524,Hamlet,47.0,3.2.139,HAMLET,"keep counsel, they'll tell all.",3,2,139,['Prologue']
34525,Hamlet,48.0,3.2.140,OPHELIA,Will he tell us what this show meant?,3,2,140,['Prologue']
34526,Hamlet,49.0,3.2.141,HAMLET,"Ay, or any show that you'll show him: be not you",3,2,141,['Prologue']
34527,Hamlet,49.0,3.2.142,HAMLET,"ashamed to show, he'll not shame to tell you what it means.",3,2,142,['Prologue']
34528,Hamlet,50.0,3.2.143,OPHELIA,"You are naught, you are naught: I'll mark the play.",3,2,143,['Prologue']
34529,Hamlet,51.0,3.2.144,Prologue,"For us, and for our tragedy,",3,2,144,['Prologue']
34530,Hamlet,51.0,3.2.145,Prologue,"Here stooping to your clemency,",3,2,145,['Prologue']
34531,Hamlet,51.0,3.2.146,Prologue,We beg your hearing patiently.,3,2,146,['Prologue']
34533,Hamlet,52.0,3.2.147,HAMLET,"Is this a prologue, or the posy of a ring?",3,2,147,[]
34534,Hamlet,53.0,3.2.148,OPHELIA,"'Tis brief, my lord.",3,2,148,[]
34535,Hamlet,54.0,3.2.149,HAMLET,As woman's love.,3,2,149,[]
34537,Hamlet,55.0,3.2.150,Player King,Full thirty times hath Phoebus' cart gone round,3,2,150,"['King', 'Queen', 'Players']"
34538,Hamlet,55.0,3.2.151,Player King,"Neptune's salt wash and Tellus' orbed ground,",3,2,151,"['King', 'Queen', 'Players']"
34539,Hamlet,55.0,3.2.152,Player King,And thirty dozen moons with borrow'd sheen,3,2,152,"['King', 'Queen', 'Players']"
34540,Hamlet,55.0,3.2.153,Player King,"About the world have times twelve thirties been,",3,2,153,"['King', 'Queen', 'Players']"
34541,Hamlet,55.0,3.2.154,Player King,Since love our hearts and Hymen did our hands,3,2,154,"['King', 'Queen', 'Players']"
34542,Hamlet,55.0,3.2.155,Player King,Unite commutual in most sacred bands.,3,2,155,"['King', 'Queen', 'Players']"
34543,Hamlet,56.0,3.2.156,Player Queen,So many journeys may the sun and moon,3,2,156,"['King', 'Queen', 'Players']"
34544,Hamlet,56.0,3.2.157,Player Queen,Make us again count o'er ere love be done!,3,2,157,"['King', 'Queen', 'Players']"
34545,Hamlet,56.0,3.2.158,Player Queen,"But, woe is me, you are so sick of late,",3,2,158,"['King', 'Queen', 'Players']"
34546,Hamlet,56.0,3.2.159,Player Queen,"So far from cheer and from your former state,",3,2,159,"['King', 'Queen', 'Players']"
34547,Hamlet,56.0,3.2.160,Player Queen,"That I distrust you. Yet, though I distrust,",3,2,160,"['King', 'Queen', 'Players']"
34548,Hamlet,56.0,3.2.161,Player Queen,"Discomfort you, my lord, it nothing must:",3,2,161,"['King', 'Queen', 'Players']"
34549,Hamlet,56.0,3.2.162,Player Queen,"For women's fear and love holds quantity,",3,2,162,"['King', 'Queen', 'Players']"
34550,Hamlet,56.0,3.2.163,Player Queen,"In neither aught, or in extremity.",3,2,163,"['King', 'Queen', 'Players']"
34551,Hamlet,56.0,3.2.164,Player Queen,"Now, what my love is, proof hath made you know,",3,2,164,"['King', 'Queen', 'Players']"
34552,Hamlet,56.0,3.2.165,Player Queen,"And as my love is sized, my fear is so:",3,2,165,"['King', 'Queen', 'Players']"
34553,Hamlet,56.0,3.2.166,Player Queen,"Where love is great, the littlest doubts are fear,",3,2,166,"['King', 'Queen', 'Players']"
34554,Hamlet,56.0,3.2.167,Player Queen,"Where little fears grow great, great love grows there.",3,2,167,"['King', 'Queen', 'Players']"
34555,Hamlet,57.0,3.2.168,Player King,"'Faith, I must leave thee, love, and shortly too,",3,2,168,"['King', 'Queen', 'Players']"
34556,Hamlet,57.0,3.2.169,Player King,My operant powers their functions leave to do:,3,2,169,"['King', 'Queen', 'Players']"
34557,Hamlet,57.0,3.2.170,Player King,"And thou shalt live in this fair world behind,",3,2,170,"['King', 'Queen', 'Players']"
34558,Hamlet,57.0,3.2.171,Player King,"Honour'd, beloved, and haply one as kind",3,2,171,"['King', 'Queen', 'Players']"
34559,Hamlet,57.0,3.2.172,Player King,For husband shalt thou--,3,2,172,"['King', 'Queen', 'Players']"
34560,Hamlet,58.0,3.2.173,Player Queen,"O, confound the rest!",3,2,173,"['King', 'Queen', 'Players']"
34561,Hamlet,58.0,3.2.174,Player Queen,Such love must needs be treason in my breast:,3,2,174,"['King', 'Queen', 'Players']"
34562,Hamlet,58.0,3.2.175,Player Queen,In second husband let me be accurst!,3,2,175,"['King', 'Queen', 'Players']"
34563,Hamlet,58.0,3.2.176,Player Queen,None wed the second but who kill'd the first.,3,2,176,"['King', 'Queen', 'Players']"
34564,Hamlet,59.0,3.2.177,HAMLET,"[Aside]  Wormwood, wormwood.",3,2,177,"['King', 'Queen', 'Players']"
34565,Hamlet,60.0,3.2.178,Player Queen,The instances that second marriage move,3,2,178,"['King', 'Queen', 'Players']"
34566,Hamlet,60.0,3.2.179,Player Queen,"Are base respects of thrift, but none of love:",3,2,179,"['King', 'Queen', 'Players']"
34567,Hamlet,60.0,3.2.180,Player Queen,"A second time I kill my husband dead,",3,2,180,"['King', 'Queen', 'Players']"
34568,Hamlet,60.0,3.2.181,Player Queen,When second husband kisses me in bed.,3,2,181,"['King', 'Queen', 'Players']"
34569,Hamlet,61.0,3.2.182,Player King,"I do believe you think what now you speak,",3,2,182,"['King', 'Queen', 'Players']"
34570,Hamlet,61.0,3.2.183,Player King,But what we do determine oft we break.,3,2,183,"['King', 'Queen', 'Players']"
34571,Hamlet,61.0,3.2.184,Player King,"Purpose is but the slave to memory,",3,2,184,"['King', 'Queen', 'Players']"
34572,Hamlet,61.0,3.2.185,Player King,"Of violent birth, but poor validity,",3,2,185,"['King', 'Queen', 'Players']"
34573,Hamlet,61.0,3.2.186,Player King,"Which now, like fruit unripe, sticks on the tree,",3,2,186,"['King', 'Queen', 'Players']"
34574,Hamlet,61.0,3.2.187,Player King,"But fall, unshaken, when they mellow be.",3,2,187,"['King', 'Queen', 'Players']"
34575,Hamlet,61.0,3.2.188,Player King,Most necessary 'tis that we forget,3,2,188,"['King', 'Queen', 'Players']"
34576,Hamlet,61.0,3.2.189,Player King,To pay ourselves what to ourselves is debt:,3,2,189,"['King', 'Queen', 'Players']"
34577,Hamlet,61.0,3.2.190,Player King,"What to ourselves in passion we propose,",3,2,190,"['King', 'Queen', 'Players']"
34578,Hamlet,61.0,3.2.191,Player King,"The passion ending, doth the purpose lose.",3,2,191,"['King', 'Queen', 'Players']"
34579,Hamlet,61.0,3.2.192,Player King,The violence of either grief or joy,3,2,192,"['King', 'Queen', 'Players']"
34580,Hamlet,61.0,3.2.193,Player King,Their own enactures with themselves destroy:,3,2,193,"['King', 'Queen', 'Players']"
34581,Hamlet,61.0,3.2.194,Player King,"Where joy most revels, grief doth most lament,",3,2,194,"['King', 'Queen', 'Players']"
34582,Hamlet,61.0,3.2.195,Player King,"Grief joys, joy grieves, on slender accident.",3,2,195,"['King', 'Queen', 'Players']"
34583,Hamlet,61.0,3.2.196,Player King,"This world is not for aye, nor 'tis not strange",3,2,196,"['King', 'Queen', 'Players']"
34584,Hamlet,61.0,3.2.197,Player King,"That even our loves should with our fortunes change,",3,2,197,"['King', 'Queen', 'Players']"
34585,Hamlet,61.0,3.2.198,Player King,"For 'tis a question left us yet to prove,",3,2,198,"['King', 'Queen', 'Players']"
34586,Hamlet,61.0,3.2.199,Player King,"Whether love lead fortune, or else fortune love.",3,2,199,"['King', 'Queen', 'Players']"
34587,Hamlet,61.0,3.2.200,Player King,"The great man down, you mark his favourite flies,",3,2,200,"['King', 'Queen', 'Players']"
34588,Hamlet,61.0,3.2.201,Player King,The poor advanced makes friends of enemies.,3,2,201,"['King', 'Queen', 'Players']"
34589,Hamlet,61.0,3.2.202,Player King,"And hitherto doth love on fortune tend,",3,2,202,"['King', 'Queen', 'Players']"
34590,Hamlet,61.0,3.2.203,Player King,"For who not needs shall never lack a friend,",3,2,203,"['King', 'Queen', 'Players']"
34591,Hamlet,61.0,3.2.204,Player King,"And who in want a hollow friend doth try,",3,2,204,"['King', 'Queen', 'Players']"
34592,Hamlet,61.0,3.2.205,Player King,Directly seasons him his enemy.,3,2,205,"['King', 'Queen', 'Players']"
34593,Hamlet,61.0,3.2.206,Player King,"But, orderly to end where I begun,",3,2,206,"['King', 'Queen', 'Players']"
34594,Hamlet,61.0,3.2.207,Player King,Our wills and fates do so contrary run,3,2,207,"['King', 'Queen', 'Players']"
34595,Hamlet,61.0,3.2.208,Player King,"That our devices still are overthrown,",3,2,208,"['King', 'Queen', 'Players']"
34596,Hamlet,61.0,3.2.209,Player King,"Our thoughts are ours, their ends none of our own:",3,2,209,"['King', 'Queen', 'Players']"
34597,Hamlet,61.0,3.2.210,Player King,"So think thou wilt no second husband wed,",3,2,210,"['King', 'Queen', 'Players']"
34598,Hamlet,61.0,3.2.211,Player King,But die thy thoughts when thy first lord is dead.,3,2,211,"['King', 'Queen', 'Players']"
34599,Hamlet,62.0,3.2.212,Player Queen,"Nor earth to me give food, nor heaven light!",3,2,212,"['King', 'Queen', 'Players']"
34600,Hamlet,62.0,3.2.213,Player Queen,Sport and repose lock from me day and night!,3,2,213,"['King', 'Queen', 'Players']"
34601,Hamlet,62.0,3.2.214,Player Queen,To desperation turn my trust and hope!,3,2,214,"['King', 'Queen', 'Players']"
34602,Hamlet,62.0,3.2.215,Player Queen,An anchor's cheer in prison be my scope!,3,2,215,"['King', 'Queen', 'Players']"
34603,Hamlet,62.0,3.2.216,Player Queen,Each opposite that blanks the face of joy,3,2,216,"['King', 'Queen', 'Players']"
34604,Hamlet,62.0,3.2.217,Player Queen,Meet what I would have well and it destroy!,3,2,217,"['King', 'Queen', 'Players']"
34605,Hamlet,62.0,3.2.218,Player Queen,"Both here and hence pursue me lasting strife,",3,2,218,"['King', 'Queen', 'Players']"
34606,Hamlet,62.0,3.2.219,Player Queen,"If, once a widow, ever I be wife!",3,2,219,"['King', 'Queen', 'Players']"
34607,Hamlet,63.0,3.2.220,HAMLET,If she should break it now!,3,2,220,"['King', 'Queen', 'Players']"
34608,Hamlet,64.0,3.2.221,Player King,"'Tis deeply sworn. Sweet, leave me here awhile,",3,2,221,"['King', 'Queen', 'Players']"
34609,Hamlet,64.0,3.2.222,Player King,"My spirits grow dull, and fain I would beguile",3,2,222,"['King', 'Queen', 'Players']"
34610,Hamlet,64.0,3.2.223,Player King,The tedious day with sleep.,3,2,223,"['King', 'Queen', 'Players']"
34612,Hamlet,65.0,3.2.224,Player Queen,"Sleep rock thy brain,",3,2,224,"['King', 'Queen', 'Players']"
34613,Hamlet,65.0,3.2.225,Player Queen,And never come mischance between us twain!,3,2,225,"['King', 'Queen', 'Players']"
34615,Hamlet,66.0,3.2.226,HAMLET,"Madam, how like you this play?",3,2,226,"['King', 'Queen', 'Players']"
34616,Hamlet,67.0,3.2.227,QUEEN GERTRUDE,"The lady protests too much, methinks.",3,2,227,"['King', 'Queen', 'Players']"
34617,Hamlet,68.0,3.2.228,HAMLET,"O, but she'll keep her word.",3,2,228,"['King', 'Queen', 'Players']"
34618,Hamlet,69.0,3.2.229,KING CLAUDIUS,Have you heard the argument? Is there no offence in 't?,3,2,229,"['King', 'Queen', 'Players']"
34619,Hamlet,70.0,3.2.230,HAMLET,"No, no, they do but jest, poison in jest, no offence",3,2,230,"['King', 'Queen', 'Players']"
34620,Hamlet,70.0,3.2.231,HAMLET,i' the world.,3,2,231,"['King', 'Queen', 'Players']"
34621,Hamlet,71.0,3.2.232,KING CLAUDIUS,What do you call the play?,3,2,232,"['King', 'Queen', 'Players']"
34622,Hamlet,72.0,3.2.233,HAMLET,"The Mouse-trap. Marry, how? Tropically. This play",3,2,233,"['King', 'Queen', 'Players']"
34623,Hamlet,72.0,3.2.234,HAMLET,is the image of a murder done in Vienna: Gonzago is,3,2,234,"['King', 'Queen', 'Players']"
34624,Hamlet,72.0,3.2.235,HAMLET,"the duke's name, his wife, Baptista: you shall see",3,2,235,"['King', 'Queen', 'Players']"
34625,Hamlet,72.0,3.2.236,HAMLET,"anon, 'tis a knavish piece of work: but what o'",3,2,236,"['King', 'Queen', 'Players']"
34626,Hamlet,72.0,3.2.237,HAMLET,"that? your majesty and we that have free souls, it",3,2,237,"['King', 'Queen', 'Players']"
34627,Hamlet,72.0,3.2.238,HAMLET,"touches us not: let the galled jade wince, our",3,2,238,"['King', 'Queen', 'Players']"
34628,Hamlet,72.0,3.2.239,HAMLET,withers are unwrung.,3,2,239,"['King', 'Queen', 'Players']"
34630,Hamlet,72.0,3.2.240,HAMLET,"This is one Lucianus, nephew to the king.",3,2,240,"['King', 'LUCIANUS', 'Queen', 'Players']"
34631,Hamlet,73.0,3.2.241,OPHELIA,"You are as good as a chorus, my lord.",3,2,241,"['King', 'LUCIANUS', 'Queen', 'Players']"
34632,Hamlet,74.0,3.2.242,HAMLET,"I could interpret between you and your love, if I",3,2,242,"['King', 'LUCIANUS', 'Queen', 'Players']"
34633,Hamlet,74.0,3.2.243,HAMLET,could see the puppets dallying.,3,2,243,"['King', 'LUCIANUS', 'Queen', 'Players']"
34634,Hamlet,75.0,3.2.244,OPHELIA,"You are keen, my lord, you are keen.",3,2,244,"['King', 'LUCIANUS', 'Queen', 'Players']"
34635,Hamlet,76.0,3.2.245,HAMLET,It would cost you a groaning to take off my edge.,3,2,245,"['King', 'LUCIANUS', 'Queen', 'Players']"
34636,Hamlet,77.0,3.2.246,OPHELIA,"Still better, and worse.",3,2,246,"['King', 'LUCIANUS', 'Queen', 'Players']"
34637,Hamlet,78.0,3.2.247,HAMLET,"So you must take your husbands. Begin, murderer,",3,2,247,"['King', 'LUCIANUS', 'Queen', 'Players']"
34638,Hamlet,78.0,3.2.248,HAMLET,"pox, leave thy damnable faces, and begin. Come:",3,2,248,"['King', 'LUCIANUS', 'Queen', 'Players']"
34639,Hamlet,78.0,3.2.249,HAMLET,'the croaking raven doth bellow for revenge.',3,2,249,"['King', 'LUCIANUS', 'Queen', 'Players']"
34640,Hamlet,79.0,3.2.250,LUCIANUS,"Thoughts black, hands apt, drugs fit, and time agreeing,",3,2,250,"['King', 'LUCIANUS', 'Queen', 'Players']"
34641,Hamlet,79.0,3.2.251,LUCIANUS,"Confederate season, else no creature seeing,",3,2,251,"['King', 'LUCIANUS', 'Queen', 'Players']"
34642,Hamlet,79.0,3.2.252,LUCIANUS,"Thou mixture rank, of midnight weeds collected,",3,2,252,"['King', 'LUCIANUS', 'Queen', 'Players']"
34643,Hamlet,79.0,3.2.253,LUCIANUS,"With Hecate's ban thrice blasted, thrice infected,",3,2,253,"['King', 'LUCIANUS', 'Queen', 'Players']"
34644,Hamlet,79.0,3.2.254,LUCIANUS,"Thy natural magic and dire property,",3,2,254,"['King', 'LUCIANUS', 'Queen', 'Players']"
34645,Hamlet,79.0,3.2.255,LUCIANUS,On wholesome life usurp immediately.,3,2,255,"['King', 'LUCIANUS', 'Queen', 'Players']"
34647,Hamlet,80.0,3.2.256,HAMLET,He poisons him i' the garden for's estate. His,3,2,256,"['King', 'LUCIANUS', 'Queen', 'Players']"
34648,Hamlet,80.0,3.2.257,HAMLET,"name's Gonzago: the story is extant, and writ in",3,2,257,"['King', 'LUCIANUS', 'Queen', 'Players']"
34649,Hamlet,80.0,3.2.258,HAMLET,choice Italian: you shall see anon how the murderer,3,2,258,"['King', 'LUCIANUS', 'Queen', 'Players']"
34650,Hamlet,80.0,3.2.259,HAMLET,gets the love of Gonzago's wife.,3,2,259,"['King', 'LUCIANUS', 'Queen', 'Players']"
34651,Hamlet,81.0,3.2.260,OPHELIA,The king rises.,3,2,260,"['King', 'LUCIANUS', 'Queen', 'Players']"
34652,Hamlet,82.0,3.2.261,HAMLET,"What, frighted with false fire!",3,2,261,"['King', 'LUCIANUS', 'Queen', 'Players']"
34653,Hamlet,83.0,3.2.262,QUEEN GERTRUDE,How fares my lord?,3,2,262,"['King', 'LUCIANUS', 'Queen', 'Players']"
34654,Hamlet,84.0,3.2.263,LORD POLONIUS,Give o'er the play.,3,2,263,"['King', 'LUCIANUS', 'Queen', 'Players']"
34655,Hamlet,85.0,3.2.264,KING CLAUDIUS,Give me some light: away!,3,2,264,"['King', 'LUCIANUS', 'Queen', 'Players']"
34656,Hamlet,86.0,3.2.265,All,"Lights, lights, lights!",3,2,265,"['King', 'LUCIANUS', 'Queen', 'Players']"
34658,Hamlet,87.0,3.2.266,HAMLET,"Why, let the stricken deer go weep,",3,2,266,"['HAMLET', 'HORATIO']"
34659,Hamlet,87.0,3.2.267,HAMLET,"The hart ungalled play,",3,2,267,"['HAMLET', 'HORATIO']"
34660,Hamlet,87.0,3.2.268,HAMLET,"For some must watch, while some must sleep:",3,2,268,"['HAMLET', 'HORATIO']"
34661,Hamlet,87.0,3.2.269,HAMLET,So runs the world away.,3,2,269,"['HAMLET', 'HORATIO']"
34662,Hamlet,87.0,3.2.270,HAMLET,"Would not this, sir, and a forest of feathers-- if",3,2,270,"['HAMLET', 'HORATIO']"
34663,Hamlet,87.0,3.2.271,HAMLET,the rest of my fortunes turn Turk with me--with two,3,2,271,"['HAMLET', 'HORATIO']"
34664,Hamlet,87.0,3.2.272,HAMLET,"Provincial roses on my razed shoes, get me a",3,2,272,"['HAMLET', 'HORATIO']"
34665,Hamlet,87.0,3.2.273,HAMLET,"fellowship in a cry of players, sir?",3,2,273,"['HAMLET', 'HORATIO']"
34666,Hamlet,88.0,3.2.274,HORATIO,Half a share.,3,2,274,"['HAMLET', 'HORATIO']"
34667,Hamlet,89.0,3.2.275,HAMLET,"A whole one, I.",3,2,275,"['HAMLET', 'HORATIO']"
34668,Hamlet,89.0,3.2.276,HAMLET,"For thou dost know, O Damon dear,",3,2,276,"['HAMLET', 'HORATIO']"
34669,Hamlet,89.0,3.2.277,HAMLET,This realm dismantled was,3,2,277,"['HAMLET', 'HORATIO']"
34670,Hamlet,89.0,3.2.278,HAMLET,"Of Jove himself, and now reigns here",3,2,278,"['HAMLET', 'HORATIO']"
34671,Hamlet,89.0,3.2.279,HAMLET,"A very, very--pajock.",3,2,279,"['HAMLET', 'HORATIO']"
34672,Hamlet,90.0,3.2.280,HORATIO,You might have rhymed.,3,2,280,"['HAMLET', 'HORATIO']"
34673,Hamlet,91.0,3.2.281,HAMLET,"O good Horatio, I'll take the ghost's word for a",3,2,281,"['HAMLET', 'HORATIO']"
34674,Hamlet,91.0,3.2.282,HAMLET,thousand pound. Didst perceive?,3,2,282,"['HAMLET', 'HORATIO']"
34675,Hamlet,92.0,3.2.283,HORATIO,"Very well, my lord.",3,2,283,"['HAMLET', 'HORATIO']"
34676,Hamlet,93.0,3.2.284,HAMLET,Upon the talk of the poisoning?,3,2,284,"['HAMLET', 'HORATIO']"
34677,Hamlet,94.0,3.2.285,HORATIO,I did very well note him.,3,2,285,"['HAMLET', 'HORATIO']"
34678,Hamlet,95.0,3.2.286,HAMLET,"Ah, ha! Come, some music! come, the recorders!",3,2,286,"['HAMLET', 'HORATIO']"
34679,Hamlet,95.0,3.2.287,HAMLET,"For if the king like not the comedy,",3,2,287,"['HAMLET', 'HORATIO']"
34680,Hamlet,95.0,3.2.288,HAMLET,"Why then, belike, he likes it not, perdy.",3,2,288,"['HAMLET', 'HORATIO']"
34681,Hamlet,95.0,3.2.289,HAMLET,"Come, some music!",3,2,289,"['HAMLET', 'HORATIO']"
34683,Hamlet,96.0,3.2.290,GUILDENSTERN,"Good my lord, vouchsafe me a word with you.",3,2,290,"['GUILDENSTERN', 'ROSENCRANTZ', 'HAMLET', 'HORATIO']"
34684,Hamlet,97.0,3.2.291,HAMLET,"Sir, a whole history.",3,2,291,"['GUILDENSTERN', 'ROSENCRANTZ', 'HAMLET', 'HORATIO']"
34685,Hamlet,98.0,3.2.292,GUILDENSTERN,"The king, sir,--",3,2,292,"['GUILDENSTERN', 'ROSENCRANTZ', 'HAMLET', 'HORATIO']"
34686,Hamlet,99.0,3.2.293,HAMLET,"Ay, sir, what of him?",3,2,293,"['GUILDENSTERN', 'ROSENCRANTZ', 'HAMLET', 'HORATIO']"
34687,Hamlet,100.0,3.2.294,GUILDENSTERN,Is in his retirement marvellous distempered.,3,2,294,"['GUILDENSTERN', 'ROSENCRANTZ', 'HAMLET', 'HORATIO']"
34688,Hamlet,101.0,3.2.295,HAMLET,"With drink, sir?",3,2,295,"['GUILDENSTERN', 'ROSENCRANTZ', 'HAMLET', 'HORATIO']"
34689,Hamlet,102.0,3.2.296,GUILDENSTERN,"No, my lord, rather with choler.",3,2,296,"['GUILDENSTERN', 'ROSENCRANTZ', 'HAMLET', 'HORATIO']"
34690,Hamlet,103.0,3.2.297,HAMLET,Your wisdom should show itself more richer to,3,2,297,"['GUILDENSTERN', 'ROSENCRANTZ', 'HAMLET', 'HORATIO']"
34691,Hamlet,103.0,3.2.298,HAMLET,"signify this to his doctor, for, for me to put him",3,2,298,"['GUILDENSTERN', 'ROSENCRANTZ', 'HAMLET', 'HORATIO']"
34692,Hamlet,103.0,3.2.299,HAMLET,to his purgation would perhaps plunge him into far,3,2,299,"['GUILDENSTERN', 'ROSENCRANTZ', 'HAMLET', 'HORATIO']"
34693,Hamlet,103.0,3.2.300,HAMLET,more choler.,3,2,300,"['GUILDENSTERN', 'ROSENCRANTZ', 'HAMLET', 'HORATIO']"
34694,Hamlet,104.0,3.2.301,GUILDENSTERN,"Good my lord, put your discourse into some frame and",3,2,301,"['GUILDENSTERN', 'ROSENCRANTZ', 'HAMLET', 'HORATIO']"
34695,Hamlet,104.0,3.2.302,GUILDENSTERN,start not so wildly from my affair.,3,2,302,"['GUILDENSTERN', 'ROSENCRANTZ', 'HAMLET', 'HORATIO']"
34696,Hamlet,105.0,3.2.303,HAMLET,"I am tame, sir: pronounce.",3,2,303,"['GUILDENSTERN', 'ROSENCRANTZ', 'HAMLET', 'HORATIO']"
34697,Hamlet,106.0,3.2.304,GUILDENSTERN,"The queen, your mother, in most great affliction of",3,2,304,"['GUILDENSTERN', 'ROSENCRANTZ', 'HAMLET', 'HORATIO']"
34698,Hamlet,106.0,3.2.305,GUILDENSTERN,"spirit, hath sent me to you.",3,2,305,"['GUILDENSTERN', 'ROSENCRANTZ', 'HAMLET', 'HORATIO']"
34699,Hamlet,107.0,3.2.306,HAMLET,You are welcome.,3,2,306,"['GUILDENSTERN', 'ROSENCRANTZ', 'HAMLET', 'HORATIO']"
34700,Hamlet,108.0,3.2.307,GUILDENSTERN,"Nay, good my lord, this courtesy is not of the right",3,2,307,"['GUILDENSTERN', 'ROSENCRANTZ', 'HAMLET', 'HORATIO']"
34701,Hamlet,108.0,3.2.308,GUILDENSTERN,breed. If it shall please you to make me a,3,2,308,"['GUILDENSTERN', 'ROSENCRANTZ', 'HAMLET', 'HORATIO']"
34702,Hamlet,108.0,3.2.309,GUILDENSTERN,"wholesome answer, I will do your mother's",3,2,309,"['GUILDENSTERN', 'ROSENCRANTZ', 'HAMLET', 'HORATIO']"
34703,Hamlet,108.0,3.2.310,GUILDENSTERN,"commandment: if not, your pardon and my return",3,2,310,"['GUILDENSTERN', 'ROSENCRANTZ', 'HAMLET', 'HORATIO']"
34704,Hamlet,108.0,3.2.311,GUILDENSTERN,shall be the end of my business.,3,2,311,"['GUILDENSTERN', 'ROSENCRANTZ', 'HAMLET', 'HORATIO']"
34705,Hamlet,109.0,3.2.312,HAMLET,"Sir, I cannot.",3,2,312,"['GUILDENSTERN', 'ROSENCRANTZ', 'HAMLET', 'HORATIO']"
34706,Hamlet,110.0,3.2.313,GUILDENSTERN,"What, my lord?",3,2,313,"['GUILDENSTERN', 'ROSENCRANTZ', 'HAMLET', 'HORATIO']"
34707,Hamlet,111.0,3.2.314,HAMLET,"Make you a wholesome answer, my wit's diseased: but,",3,2,314,"['GUILDENSTERN', 'ROSENCRANTZ', 'HAMLET', 'HORATIO']"
34708,Hamlet,111.0,3.2.315,HAMLET,"sir, such answer as I can make, you shall command,",3,2,315,"['GUILDENSTERN', 'ROSENCRANTZ', 'HAMLET', 'HORATIO']"
34709,Hamlet,111.0,3.2.316,HAMLET,"or, rather, as you say, my mother: therefore no",3,2,316,"['GUILDENSTERN', 'ROSENCRANTZ', 'HAMLET', 'HORATIO']"
34710,Hamlet,111.0,3.2.317,HAMLET,"more, but to the matter: my mother, you say,--",3,2,317,"['GUILDENSTERN', 'ROSENCRANTZ', 'HAMLET', 'HORATIO']"
34711,Hamlet,112.0,3.2.318,ROSENCRANTZ,"Then thus she says, your behavior hath struck her",3,2,318,"['GUILDENSTERN', 'ROSENCRANTZ', 'HAMLET', 'HORATIO']"
34712,Hamlet,112.0,3.2.319,ROSENCRANTZ,into amazement and admiration.,3,2,319,"['GUILDENSTERN', 'ROSENCRANTZ', 'HAMLET', 'HORATIO']"
34713,Hamlet,113.0,3.2.320,HAMLET,"O wonderful son, that can so astonish a mother! But",3,2,320,"['GUILDENSTERN', 'ROSENCRANTZ', 'HAMLET', 'HORATIO']"
34714,Hamlet,113.0,3.2.321,HAMLET,is there no sequel at the heels of this mother's,3,2,321,"['GUILDENSTERN', 'ROSENCRANTZ', 'HAMLET', 'HORATIO']"
34715,Hamlet,113.0,3.2.322,HAMLET,admiration? Impart.,3,2,322,"['GUILDENSTERN', 'ROSENCRANTZ', 'HAMLET', 'HORATIO']"
34716,Hamlet,114.0,3.2.323,ROSENCRANTZ,"She desires to speak with you in her closet, ere you",3,2,323,"['GUILDENSTERN', 'ROSENCRANTZ', 'HAMLET', 'HORATIO']"
34717,Hamlet,114.0,3.2.324,ROSENCRANTZ,go to bed.,3,2,324,"['GUILDENSTERN', 'ROSENCRANTZ', 'HAMLET', 'HORATIO']"
34718,Hamlet,115.0,3.2.325,HAMLET,"We shall obey, were she ten times our mother. Have",3,2,325,"['GUILDENSTERN', 'ROSENCRANTZ', 'HAMLET', 'HORATIO']"
34719,Hamlet,115.0,3.2.326,HAMLET,you any further trade with us?,3,2,326,"['GUILDENSTERN', 'ROSENCRANTZ', 'HAMLET', 'HORATIO']"
34720,Hamlet,116.0,3.2.327,ROSENCRANTZ,"My lord, you once did love me.",3,2,327,"['GUILDENSTERN', 'ROSENCRANTZ', 'HAMLET', 'HORATIO']"
34721,Hamlet,117.0,3.2.328,HAMLET,"So I do still, by these pickers and stealers.",3,2,328,"['GUILDENSTERN', 'ROSENCRANTZ', 'HAMLET', 'HORATIO']"
34722,Hamlet,118.0,3.2.329,ROSENCRANTZ,"Good my lord, what is your cause of distemper? you",3,2,329,"['GUILDENSTERN', 'ROSENCRANTZ', 'HAMLET', 'HORATIO']"
34723,Hamlet,118.0,3.2.330,ROSENCRANTZ,"do, surely, bar the door upon your own liberty, if",3,2,330,"['GUILDENSTERN', 'ROSENCRANTZ', 'HAMLET', 'HORATIO']"
34724,Hamlet,118.0,3.2.331,ROSENCRANTZ,you deny your griefs to your friend.,3,2,331,"['GUILDENSTERN', 'ROSENCRANTZ', 'HAMLET', 'HORATIO']"
34725,Hamlet,119.0,3.2.332,HAMLET,"Sir, I lack advancement.",3,2,332,"['GUILDENSTERN', 'ROSENCRANTZ', 'HAMLET', 'HORATIO']"
34726,Hamlet,120.0,3.2.333,ROSENCRANTZ,"How can that be, when you have the voice of the king",3,2,333,"['GUILDENSTERN', 'ROSENCRANTZ', 'HAMLET', 'HORATIO']"
34727,Hamlet,120.0,3.2.334,ROSENCRANTZ,himself for your succession in Denmark?,3,2,334,"['GUILDENSTERN', 'ROSENCRANTZ', 'HAMLET', 'HORATIO']"
34728,Hamlet,121.0,3.2.335,HAMLET,"Ay, but sir, 'While the grass grows,'--the proverb",3,2,335,"['GUILDENSTERN', 'ROSENCRANTZ', 'HAMLET', 'HORATIO']"
34729,Hamlet,121.0,3.2.336,HAMLET,is something musty.,3,2,336,"['GUILDENSTERN', 'ROSENCRANTZ', 'HAMLET', 'HORATIO']"
34731,Hamlet,121.0,3.2.337,HAMLET,"O, the recorders! let me see one. To withdraw with",3,2,337,"['HORATIO', 'ROSENCRANTZ', 'HAMLET', 'GUILDENSTERN', 'Players']"
