Dataline,Play,PlayerLinenumber,ActSceneLine,Player,PlayerLine,Act,Scene,Line,Characters
32436,Hamlet,1.0,1.1.1,BERNARDO,Who's there?,1,1,1,"['FRANCISCO', 'BERNARDO']"
32437,Hamlet,2.0,1.1.2,FRANCISCO,"Nay, answer me: stand, and unfold yourself.",1,1,2,"['FRANCISCO', 'BERNARDO']"
32438,Hamlet,3.0,1.1.3,BERNARDO,Long live the king!,1,1,3,"['FRANCISCO', 'BERNARDO']"
32439,Hamlet,4.0,1.1.4,FRANCISCO,Bernardo?,1,1,4,"['FRANCISCO', 'BERNARDO']"
32440,Hamlet,5.0,1.1.5,BERNARDO,He.,1,1,5,"['FRANCISCO', 'BERNARDO']"
32441,Hamlet,6.0,1.1.6,FRANCISCO,You come most carefully upon your hour.,1,1,6,"['FRANCISCO', 'BERNARDO']"
32442,Hamlet,7.0,1.1.7,BERNARDO,"'Tis now struck twelve, get thee to bed, Francisco.",1,1,7,"['FRANCISCO', 'BERNARDO']"
32443,Hamlet,8.0,1.1.8,FRANCISCO,"For this relief much thanks: 'tis bitter cold,",1,1,8,"['FRANCISCO', 'BERNARDO']"
32444,Hamlet,8.0,1.1.9,FRANCISCO,And I am sick at heart.,1,1,9,"['FRANCISCO', 'BERNARDO']"
32445,Hamlet,9.0,1.1.10,BERNARDO,Have you had quiet guard?,1,1,10,"['FRANCISCO', 'BERNARDO']"
32446,Hamlet,10.0,1.1.11,FRANCISCO,Not a mouse stirring.,1,1,11,"['FRANCISCO', 'BERNARDO']"
32447,Hamlet,11.0,1.1.12,BERNARDO,"Well, good night.",1,1,12,"['FRANCISCO', 'BERNARDO']"
32448,Hamlet,11.0,1.1.13,BERNARDO,"If you do meet Horatio and Marcellus,",1,1,13,"['FRANCISCO', 'BERNARDO']"
32449,Hamlet,11.0,1.1.14,BERNARDO,"The rivals of my watch, bid them make haste.",1,1,14,"['FRANCISCO', 'BERNARDO']"
32450,Hamlet,12.0,1.1.15,FRANCISCO,"I think I hear them. Stand, ho! Who's there?",1,1,15,"['FRANCISCO', 'BERNARDO']"
32452,Hamlet,13.0,1.1.16,HORATIO,Friends to this ground.,1,1,16,"['FRANCISCO', 'BERNARDO', 'MARCELLUS', 'HORATIO']"
32453,Hamlet,14.0,1.1.17,MARCELLUS,And liegemen to the Dane.,1,1,17,"['FRANCISCO', 'BERNARDO', 'MARCELLUS', 'HORATIO']"
32454,Hamlet,15.0,1.1.18,FRANCISCO,Give you good night.,1,1,18,"['FRANCISCO', 'BERNARDO', 'MARCELLUS', 'HORATIO']"
32455,Hamlet,16.0,1.1.19,MARCELLUS,"O, farewell, honest soldier:",1,1,19,"['FRANCISCO', 'BERNARDO', 'MARCELLUS', 'HORATIO']"
32456,Hamlet,16.0,1.1.20,MARCELLUS,Who hath relieved you?,1,1,20,"['FRANCISCO', 'BERNARDO', 'MARCELLUS', 'HORATIO']"
32457,Hamlet,17.0,1.1.21,FRANCISCO,Bernardo has my place.,1,1,21,"['FRANCISCO', 'BERNARDO', 'MARCELLUS', 'HORATIO']"
32458,Hamlet,17.0,1.1.22,FRANCISCO,Give you good night.,1,1,22,"['FRANCISCO', 'BERNARDO', 'MARCELLUS', 'HORATIO']"
32460,Hamlet,18.0,1.1.23,MARCELLUS,Holla! Bernardo!,1,1,23,"['BERNARDO', 'MARCELLUS', 'HORATIO']"
32461,Hamlet,19.0,1.1.24,BERNARDO,"Say,",1,1,24,"['BERNARDO', 'MARCELLUS', 'HORATIO']"
32462,Hamlet,19.0,1.1.25,BERNARDO,"What, is Horatio there?",1,1,25,"['BERNARDO', 'MARCELLUS', 'HORATIO']"
32463,Hamlet,20.0,1.1.26,HORATIO,A piece of him.,1,1,26,"['BERNARDO', 'MARCELLUS', 'HORATIO']"
32464,Hamlet,21.0,1.1.27,BERNARDO,"Welcome, Horatio: welcome, good Marcellus.",1,1,27,"['BERNARDO', 'MARCELLUS', 'HORATIO']"
32465,Hamlet,22.0,1.1.28,MARCELLUS,"What, has this thing appear'd again to-night?",1,1,28,"['BERNARDO', 'MARCELLUS', 'HORATIO']"
32466,Hamlet,23.0,1.1.29,BERNARDO,I have seen nothing.,1,1,29,"['BERNARDO', 'MARCELLUS', 'HORATIO']"
32467,Hamlet,24.0,1.1.30,MARCELLUS,"Horatio says 'tis but our fantasy,",1,1,30,"['BERNARDO', 'MARCELLUS', 'HORATIO']"
32468,Hamlet,24.0,1.1.31,MARCELLUS,And will not let belief take hold of him,1,1,31,"['BERNARDO', 'MARCELLUS', 'HORATIO']"
32469,Hamlet,24.0,1.1.32,MARCELLUS,"Touching this dreaded sight, twice seen of us:",1,1,32,"['BERNARDO', 'MARCELLUS', 'HORATIO']"
32470,Hamlet,24.0,1.1.33,MARCELLUS,Therefore I have entreated him along,1,1,33,"['BERNARDO', 'MARCELLUS', 'HORATIO']"
32471,Hamlet,24.0,1.1.34,MARCELLUS,"With us to watch the minutes of this night,",1,1,34,"['BERNARDO', 'MARCELLUS', 'HORATIO']"
32472,Hamlet,24.0,1.1.35,MARCELLUS,"That if again this apparition come,",1,1,35,"['BERNARDO', 'MARCELLUS', 'HORATIO']"
32473,Hamlet,24.0,1.1.36,MARCELLUS,He may approve our eyes and speak to it.,1,1,36,"['BERNARDO', 'MARCELLUS', 'HORATIO']"
32474,Hamlet,25.0,1.1.37,HORATIO,"Tush, tush, 'twill not appear.",1,1,37,"['BERNARDO', 'MARCELLUS', 'HORATIO']"
32475,Hamlet,26.0,1.1.38,BERNARDO,"Sit down awhile,",1,1,38,"['BERNARDO', 'MARCELLUS', 'HORATIO']"
32476,Hamlet,26.0,1.1.39,BERNARDO,"And let us once again assail your ears,",1,1,39,"['BERNARDO', 'MARCELLUS', 'HORATIO']"
32477,Hamlet,26.0,1.1.40,BERNARDO,That are so fortified against our story,1,1,40,"['BERNARDO', 'MARCELLUS', 'HORATIO']"
32478,Hamlet,26.0,1.1.41,BERNARDO,What we have two nights seen.,1,1,41,"['BERNARDO', 'MARCELLUS', 'HORATIO']"
32479,Hamlet,27.0,1.1.42,HORATIO,"Well, sit we down,",1,1,42,"['BERNARDO', 'MARCELLUS', 'HORATIO']"
32480,Hamlet,27.0,1.1.43,HORATIO,And let us hear Bernardo speak of this.,1,1,43,"['BERNARDO', 'MARCELLUS', 'HORATIO']"
32481,Hamlet,28.0,1.1.44,BERNARDO,"Last night of all,",1,1,44,"['BERNARDO', 'MARCELLUS', 'HORATIO']"
32482,Hamlet,28.0,1.1.45,BERNARDO,When yond same star that's westward from the pole,1,1,45,"['BERNARDO', 'MARCELLUS', 'HORATIO']"
32483,Hamlet,28.0,1.1.46,BERNARDO,Had made his course to illume that part of heaven,1,1,46,"['BERNARDO', 'MARCELLUS', 'HORATIO']"
32484,Hamlet,28.0,1.1.47,BERNARDO,"Where now it burns, Marcellus and myself,",1,1,47,"['BERNARDO', 'MARCELLUS', 'HORATIO']"
32485,Hamlet,28.0,1.1.48,BERNARDO,"The bell then beating one,--",1,1,48,"['BERNARDO', 'MARCELLUS', 'HORATIO']"
32487,Hamlet,29.0,1.1.49,MARCELLUS,"Peace, break thee off, look, where it comes again!",1,1,49,"['MARCELLUS', 'BERNARDO', 'Ghost', 'HORATIO']"
32488,Hamlet,30.0,1.1.50,BERNARDO,"In the same figure, like the king that's dead.",1,1,50,"['MARCELLUS', 'BERNARDO', 'Ghost', 'HORATIO']"
32489,Hamlet,31.0,1.1.51,MARCELLUS,"Thou art a scholar, speak to it, Horatio.",1,1,51,"['MARCELLUS', 'BERNARDO', 'Ghost', 'HORATIO']"
32490,Hamlet,32.0,1.1.52,BERNARDO,"Looks it not like the king?  mark it, Horatio.",1,1,52,"['MARCELLUS', 'BERNARDO', 'Ghost', 'HORATIO']"
32491,Hamlet,33.0,1.1.53,HORATIO,Most like: it harrows me with fear and wonder.,1,1,53,"['MARCELLUS', 'BERNARDO', 'Ghost', 'HORATIO']"
32492,Hamlet,34.0,1.1.54,BERNARDO,It would be spoke to.,1,1,54,"['MARCELLUS', 'BERNARDO', 'Ghost', 'HORATIO']"
32493,Hamlet,35.0,1.1.55,MARCELLUS,"Question it, Horatio.",1,1,55,"['MARCELLUS', 'BERNARDO', 'Ghost', 'HORATIO']"
32494,Hamlet,36.0,1.1.56,HORATIO,"What art thou that usurp'st this time of night,",1,1,56,"['MARCELLUS', 'BERNARDO', 'Ghost', 'HORATIO']"
32495,Hamlet,36.0,1.1.57,HORATIO,Together with that fair and warlike form,1,1,57,"['MARCELLUS', 'BERNARDO', 'Ghost', 'HORATIO']"
32496,Hamlet,36.0,1.1.58,HORATIO,In which the majesty of buried Denmark,1,1,58,"['MARCELLUS', 'BERNARDO', 'Ghost', 'HORATIO']"
32497,Hamlet,36.0,1.1.59,HORATIO,"Did sometimes march? by heaven I charge thee, speak!",1,1,59,"['MARCELLUS', 'BERNARDO', 'Ghost', 'HORATIO']"
32498,Hamlet,37.0,1.1.60,MARCELLUS,It is offended.,1,1,60,"['MARCELLUS', 'BERNARDO', 'Ghost', 'HORATIO']"
32499,Hamlet,38.0,1.1.61,BERNARDO,"See, it stalks away!",1,1,61,"['MARCELLUS', 'BERNARDO', 'Ghost', 'HORATIO']"
32500,Hamlet,39.0,1.1.62,HORATIO,"Stay! speak, speak! I charge thee, speak!",1,1,62,"['MARCELLUS', 'BERNARDO', 'Ghost', 'HORATIO']"
32502,Hamlet,40.0,1.1.63,MARCELLUS,"'Tis gone, and will not answer.",1,1,63,"['MARCELLUS', 'BERNARDO', 'HORATIO']"
32503,Hamlet,41.0,1.1.64,BERNARDO,"How now, Horatio! you tremble and look pale:",1,1,64,"['MARCELLUS', 'BERNARDO', 'HORATIO']"
32504,Hamlet,41.0,1.1.65,BERNARDO,Is not this something more than fantasy?,1,1,65,"['MARCELLUS', 'BERNARDO', 'HORATIO']"
32505,Hamlet,41.0,1.1.66,BERNARDO,What think you on't?,1,1,66,"['MARCELLUS', 'BERNARDO', 'HORATIO']"
32506,Hamlet,42.0,1.1.67,HORATIO,"Before my God, I might not this believe",1,1,67,"['MARCELLUS', 'BERNARDO', 'HORATIO']"
32507,Hamlet,42.0,1.1.68,HORATIO,Without the sensible and true avouch,1,1,68,"['MARCELLUS', 'BERNARDO', 'HORATIO']"
32508,Hamlet,42.0,1.1.69,HORATIO,Of mine own eyes.,1,1,69,"['MARCELLUS', 'BERNARDO', 'HORATIO']"
32509,Hamlet,43.0,1.1.70,MARCELLUS,Is it not like the king?,1,1,70,"['MARCELLUS', 'BERNARDO', 'HORATIO']"
32510,Hamlet,44.0,1.1.71,HORATIO,As thou art to thyself:,1,1,71,"['MARCELLUS', 'BERNARDO', 'HORATIO']"
32511,Hamlet,44.0,1.1.72,HORATIO,Such was the very armour he had on,1,1,72,"['MARCELLUS', 'BERNARDO', 'HORATIO']"
32512,Hamlet,44.0,1.1.73,HORATIO,"When he the ambitious Norway combated,",1,1,73,"['MARCELLUS', 'BERNARDO', 'HORATIO']"
32513,Hamlet,44.0,1.1.74,HORATIO,"So frown'd he once, when, in an angry parle,",1,1,74,"['MARCELLUS', 'BERNARDO', 'HORATIO']"
32514,Hamlet,44.0,1.1.75,HORATIO,He smote the sledded Polacks on the ice.,1,1,75,"['MARCELLUS', 'BERNARDO', 'HORATIO']"
32515,Hamlet,44.0,1.1.76,HORATIO,'Tis strange.,1,1,76,"['MARCELLUS', 'BERNARDO', 'HORATIO']"
32516,Hamlet,45.0,1.1.77,MARCELLUS,"Thus twice before, and jump at this dead hour,",1,1,77,"['MARCELLUS', 'BERNARDO', 'HORATIO']"
32517,Hamlet,45.0,1.1.78,MARCELLUS,With martial stalk hath he gone by our watch.,1,1,78,"['MARCELLUS', 'BERNARDO', 'HORATIO']"
32518,Hamlet,46.0,1.1.79,HORATIO,"In what particular thought to work I know not,",1,1,79,"['MARCELLUS', 'BERNARDO', 'HORATIO']"
32519,Hamlet,46.0,1.1.80,HORATIO,"But in the gross and scope of my opinion,",1,1,80,"['MARCELLUS', 'BERNARDO', 'HORATIO']"
32520,Hamlet,46.0,1.1.81,HORATIO,This bodes some strange eruption to our state.,1,1,81,"['MARCELLUS', 'BERNARDO', 'HORATIO']"
32521,Hamlet,47.0,1.1.82,MARCELLUS,"Good now, sit down, and tell me, he that knows,",1,1,82,"['MARCELLUS', 'BERNARDO', 'HORATIO']"
32522,Hamlet,47.0,1.1.83,MARCELLUS,Why this same strict and most observant watch,1,1,83,"['MARCELLUS', 'BERNARDO', 'HORATIO']"
32523,Hamlet,47.0,1.1.84,MARCELLUS,"So nightly toils the subject of the land,",1,1,84,"['MARCELLUS', 'BERNARDO', 'HORATIO']"
32524,Hamlet,47.0,1.1.85,MARCELLUS,"And why such daily cast of brazen cannon,",1,1,85,"['MARCELLUS', 'BERNARDO', 'HORATIO']"
32525,Hamlet,47.0,1.1.86,MARCELLUS,"And foreign mart for implements of war,",1,1,86,"['MARCELLUS', 'BERNARDO', 'HORATIO']"
32526,Hamlet,47.0,1.1.87,MARCELLUS,"Why such impress of shipwrights, whose sore task",1,1,87,"['MARCELLUS', 'BERNARDO', 'HORATIO']"
32527,Hamlet,47.0,1.1.88,MARCELLUS,"Does not divide the Sunday from the week,",1,1,88,"['MARCELLUS', 'BERNARDO', 'HORATIO']"
32528,Hamlet,47.0,1.1.89,MARCELLUS,"What might be toward, that this sweaty haste",1,1,89,"['MARCELLUS', 'BERNARDO', 'HORATIO']"
32529,Hamlet,47.0,1.1.90,MARCELLUS,Doth make the night joint-labourer with the day:,1,1,90,"['MARCELLUS', 'BERNARDO', 'HORATIO']"
32530,Hamlet,47.0,1.1.91,MARCELLUS,Who is't that can inform me?,1,1,91,"['MARCELLUS', 'BERNARDO', 'HORATIO']"
32531,Hamlet,48.0,1.1.92,HORATIO,"That can I,",1,1,92,"['MARCELLUS', 'BERNARDO', 'HORATIO']"
32532,Hamlet,48.0,1.1.93,HORATIO,"At least, the whisper goes so. Our last king,",1,1,93,"['MARCELLUS', 'BERNARDO', 'HORATIO']"
32533,Hamlet,48.0,1.1.94,HORATIO,"Whose image even but now appear'd to us,",1,1,94,"['MARCELLUS', 'BERNARDO', 'HORATIO']"
32534,Hamlet,48.0,1.1.95,HORATIO,"Was, as you know, by Fortinbras of Norway,",1,1,95,"['MARCELLUS', 'BERNARDO', 'HORATIO']"
32535,Hamlet,48.0,1.1.96,HORATIO,"Thereto prick'd on by a most emulate pride,",1,1,96,"['MARCELLUS', 'BERNARDO', 'HORATIO']"
32536,Hamlet,48.0,1.1.97,HORATIO,"Dared to the combat, in which our valiant Hamlet--",1,1,97,"['MARCELLUS', 'BERNARDO', 'HORATIO']"
32537,Hamlet,48.0,1.1.98,HORATIO,For so this side of our known world esteem'd him--,1,1,98,"['MARCELLUS', 'BERNARDO', 'HORATIO']"
32538,Hamlet,48.0,1.1.99,HORATIO,"Did slay this Fortinbras, who by a seal'd compact,",1,1,99,"['MARCELLUS', 'BERNARDO', 'HORATIO']"
32539,Hamlet,48.0,1.1.100,HORATIO,"Well ratified by law and heraldry,",1,1,100,"['MARCELLUS', 'BERNARDO', 'HORATIO']"
32540,Hamlet,48.0,1.1.101,HORATIO,"Did forfeit, with his life, all those his lands",1,1,101,"['MARCELLUS', 'BERNARDO', 'HORATIO']"
32541,Hamlet,48.0,1.1.102,HORATIO,"Which he stood seized of, to the conqueror:",1,1,102,"['MARCELLUS', 'BERNARDO', 'HORATIO']"
32542,Hamlet,48.0,1.1.103,HORATIO,"Against the which, a moiety competent",1,1,103,"['MARCELLUS', 'BERNARDO', 'HORATIO']"
32543,Hamlet,48.0,1.1.104,HORATIO,"Was gaged by our king, which had return'd",1,1,104,"['MARCELLUS', 'BERNARDO', 'HORATIO']"
32544,Hamlet,48.0,1.1.105,HORATIO,"To the inheritance of Fortinbras,",1,1,105,"['MARCELLUS', 'BERNARDO', 'HORATIO']"
32545,Hamlet,48.0,1.1.106,HORATIO,"Had he been vanquisher, as, by the same covenant,",1,1,106,"['MARCELLUS', 'BERNARDO', 'HORATIO']"
32546,Hamlet,48.0,1.1.107,HORATIO,"And carriage of the article design'd,",1,1,107,"['MARCELLUS', 'BERNARDO', 'HORATIO']"
32547,Hamlet,48.0,1.1.108,HORATIO,"His fell to Hamlet. Now, sir, young Fortinbras,",1,1,108,"['MARCELLUS', 'BERNARDO', 'HORATIO']"
32548,Hamlet,48.0,1.1.109,HORATIO,"Of unimproved mettle hot and full,",1,1,109,"['MARCELLUS', 'BERNARDO', 'HORATIO']"
32549,Hamlet,48.0,1.1.110,HORATIO,Hath in the skirts of Norway here and there,1,1,110,"['MARCELLUS', 'BERNARDO', 'HORATIO']"
32550,Hamlet,48.0,1.1.111,HORATIO,"Shark'd up a list of lawless resolutes,",1,1,111,"['MARCELLUS', 'BERNARDO', 'HORATIO']"
32551,Hamlet,48.0,1.1.112,HORATIO,"For food and diet, to some enterprise",1,1,112,"['MARCELLUS', 'BERNARDO', 'HORATIO']"
32552,Hamlet,48.0,1.1.113,HORATIO,"That hath a stomach in't, which is no other--",1,1,113,"['MARCELLUS', 'BERNARDO', 'HORATIO']"
32553,Hamlet,48.0,1.1.114,HORATIO,As it doth well appear unto our state--,1,1,114,"['MARCELLUS', 'BERNARDO', 'HORATIO']"
32554,Hamlet,48.0,1.1.115,HORATIO,"But to recover of us, by strong hand",1,1,115,"['MARCELLUS', 'BERNARDO', 'HORATIO']"
32555,Hamlet,48.0,1.1.116,HORATIO,"And terms compulsatory, those foresaid lands",1,1,116,"['MARCELLUS', 'BERNARDO', 'HORATIO']"
32556,Hamlet,48.0,1.1.117,HORATIO,"So by his father lost: and this, I take it,",1,1,117,"['MARCELLUS', 'BERNARDO', 'HORATIO']"
32557,Hamlet,48.0,1.1.118,HORATIO,"Is the main motive of our preparations,",1,1,118,"['MARCELLUS', 'BERNARDO', 'HORATIO']"
32558,Hamlet,48.0,1.1.119,HORATIO,The source of this our watch and the chief head,1,1,119,"['MARCELLUS', 'BERNARDO', 'HORATIO']"
32559,Hamlet,48.0,1.1.120,HORATIO,Of this post-haste and romage in the land.,1,1,120,"['MARCELLUS', 'BERNARDO', 'HORATIO']"
32560,Hamlet,49.0,1.1.121,BERNARDO,I think it be no other but e'en so:,1,1,121,"['MARCELLUS', 'BERNARDO', 'HORATIO']"
32561,Hamlet,49.0,1.1.122,BERNARDO,Well may it sort that this portentous figure,1,1,122,"['MARCELLUS', 'BERNARDO', 'HORATIO']"
32562,Hamlet,49.0,1.1.123,BERNARDO,"Comes armed through our watch, so like the king",1,1,123,"['MARCELLUS', 'BERNARDO', 'HORATIO']"
32563,Hamlet,49.0,1.1.124,BERNARDO,That was and is the question of these wars.,1,1,124,"['MARCELLUS', 'BERNARDO', 'HORATIO']"
32564,Hamlet,50.0,1.1.125,HORATIO,A mote it is to trouble the mind's eye.,1,1,125,"['MARCELLUS', 'BERNARDO', 'HORATIO']"
32565,Hamlet,50.0,1.1.126,HORATIO,"In the most high and palmy state of Rome,",1,1,126,"['MARCELLUS', 'BERNARDO', 'HORATIO']"
32566,Hamlet,50.0,1.1.127,HORATIO,"A little ere the mightiest Julius fell,",1,1,127,"['MARCELLUS', 'BERNARDO', 'HORATIO']"
32567,Hamlet,50.0,1.1.128,HORATIO,The graves stood tenantless and the sheeted dead,1,1,128,"['MARCELLUS', 'BERNARDO', 'HORATIO']"
32568,Hamlet,50.0,1.1.129,HORATIO,Did squeak and gibber in the Roman streets:,1,1,129,"['MARCELLUS', 'BERNARDO', 'HORATIO']"
32569,Hamlet,50.0,1.1.130,HORATIO,"As stars with trains of fire and dews of blood,",1,1,130,"['MARCELLUS', 'BERNARDO', 'HORATIO']"
32570,Hamlet,50.0,1.1.131,HORATIO,"Disasters in the sun, and the moist star",1,1,131,"['MARCELLUS', 'BERNARDO', 'HORATIO']"
32571,Hamlet,50.0,1.1.132,HORATIO,Upon whose influence Neptune's empire stands,1,1,132,"['MARCELLUS', 'BERNARDO', 'HORATIO']"
32572,Hamlet,50.0,1.1.133,HORATIO,Was sick almost to doomsday with eclipse:,1,1,133,"['MARCELLUS', 'BERNARDO', 'HORATIO']"
32573,Hamlet,50.0,1.1.134,HORATIO,"And even the like precurse of fierce events,",1,1,134,"['MARCELLUS', 'BERNARDO', 'HORATIO']"
32574,Hamlet,50.0,1.1.135,HORATIO,As harbingers preceding still the fates,1,1,135,"['MARCELLUS', 'BERNARDO', 'HORATIO']"
32575,Hamlet,50.0,1.1.136,HORATIO,"And prologue to the omen coming on,",1,1,136,"['MARCELLUS', 'BERNARDO', 'HORATIO']"
32576,Hamlet,50.0,1.1.137,HORATIO,Have heaven and earth together demonstrated,1,1,137,"['MARCELLUS', 'BERNARDO', 'HORATIO']"
32577,Hamlet,50.0,1.1.138,HORATIO,Unto our climatures and countrymen.--,1,1,138,"['MARCELLUS', 'BERNARDO', 'HORATIO']"
32578,Hamlet,50.0,1.1.139,HORATIO,"But soft, behold! lo, where it comes again!",1,1,139,"['MARCELLUS', 'BERNARDO', 'HORATIO']"
32580,Hamlet,50.0,1.1.140,HORATIO,"I'll cross it, though it blast me. Stay, illusion!",1,1,140,"['MARCELLUS', 'BERNARDO', 'Ghost', 'HORATIO']"
32581,Hamlet,50.0,1.1.141,HORATIO,"If thou hast any sound, or use of voice,",1,1,141,"['MARCELLUS', 'BERNARDO', 'Ghost', 'HORATIO']"
32582,Hamlet,50.0,1.1.142,HORATIO,Speak to me:,1,1,142,"['MARCELLUS', 'BERNARDO', 'Ghost', 'HORATIO']"
32583,Hamlet,50.0,1.1.143,HORATIO,"If there be any good thing to be done,",1,1,143,"['MARCELLUS', 'BERNARDO', 'Ghost', 'HORATIO']"
32584,Hamlet,50.0,1.1.144,HORATIO,"That may to thee do ease and grace to me,",1,1,144,"['MARCELLUS', 'BERNARDO', 'Ghost', 'HORATIO']"
32585,Hamlet,50.0,1.1.145,HORATIO,Speak to me:,1,1,145,"['MARCELLUS', 'BERNARDO', 'Ghost', 'HORATIO']"
32587,Hamlet,50.0,1.1.146,HORATIO,"If thou art privy to thy country's fate,",1,1,146,"['MARCELLUS', 'BERNARDO', 'Ghost', 'HORATIO']"
32588,Hamlet,50.0,1.1.147,HORATIO,"Which, happily, foreknowing may avoid, O, speak!",1,1,147,"['MARCELLUS', 'BERNARDO', 'Ghost', 'HORATIO']"
32589,Hamlet,50.0,1.1.148,HORATIO,Or if thou hast uphoarded in thy life,1,1,148,"['MARCELLUS', 'BERNARDO', 'Ghost', 'HORATIO']"
32590,Hamlet,50.0,1.1.149,HORATIO,"Extorted treasure in the womb of earth,",1,1,149,"['MARCELLUS', 'BERNARDO', 'Ghost', 'HORATIO']"
32591,Hamlet,50.0,1.1.150,HORATIO,"For which, they say, you spirits oft walk in death,",1,1,150,"['MARCELLUS', 'BERNARDO', 'Ghost', 'HORATIO']"
32592,Hamlet,50.0,1.1.151,HORATIO,"Speak of it: stay, and speak! Stop it, Marcellus.",1,1,151,"['MARCELLUS', 'BERNARDO', 'Ghost', 'HORATIO']"
32593,Hamlet,51.0,1.1.152,MARCELLUS,Shall I strike at it with my partisan?,1,1,152,"['MARCELLUS', 'BERNARDO', 'Ghost', 'HORATIO']"
32594,Hamlet,52.0,1.1.153,HORATIO,"Do, if it will not stand.",1,1,153,"['MARCELLUS', 'BERNARDO', 'Ghost', 'HORATIO']"
32595,Hamlet,53.0,1.1.154,BERNARDO,'Tis here!,1,1,154,"['MARCELLUS', 'BERNARDO', 'Ghost', 'HORATIO']"
32596,Hamlet,54.0,1.1.155,HORATIO,'Tis here!,1,1,155,"['MARCELLUS', 'BERNARDO', 'Ghost', 'HORATIO']"
32597,Hamlet,55.0,1.1.156,MARCELLUS,'Tis gone!,1,1,156,"['MARCELLUS', 'BERNARDO', 'Ghost', 'HORATIO']"
32599,Hamlet,55.0,1.1.157,MARCELLUS,"We do it wrong, being so majestical,",1,1,157,"['MARCELLUS', 'BERNARDO', 'HORATIO']"
32600,Hamlet,55.0,1.1.158,MARCELLUS,"To offer it the show of violence,",1,1,158,"['MARCELLUS', 'BERNARDO', 'HORATIO']"
32601,Hamlet,55.0,1.1.159,MARCELLUS,"For it is, as the air, invulnerable,",1,1,159,"['MARCELLUS', 'BERNARDO', 'HORATIO']"
32602,Hamlet,55.0,1.1.160,MARCELLUS,And our vain blows malicious mockery.,1,1,160,"['MARCELLUS', 'BERNARDO', 'HORATIO']"
32603,Hamlet,56.0,1.1.161,BERNARDO,"It was about to speak, when the cock crew.",1,1,161,"['MARCELLUS', 'BERNARDO', 'HORATIO']"
32604,Hamlet,57.0,1.1.162,HORATIO,And then it started like a guilty thing,1,1,162,"['MARCELLUS', 'BERNARDO', 'HORATIO']"
32605,Hamlet,57.0,1.1.163,HORATIO,"Upon a fearful summons. I have heard,",1,1,163,"['MARCELLUS', 'BERNARDO', 'HORATIO']"
32606,Hamlet,57.0,1.1.164,HORATIO,"The cock, that is the trumpet to the morn,",1,1,164,"['MARCELLUS', 'BERNARDO', 'HORATIO']"
32607,Hamlet,57.0,1.1.165,HORATIO,Doth with his lofty and shrill-sounding throat,1,1,165,"['MARCELLUS', 'BERNARDO', 'HORATIO']"
32608,Hamlet,57.0,1.1.166,HORATIO,"Awake the god of day, and, at his warning,",1,1,166,"['MARCELLUS', 'BERNARDO', 'HORATIO']"
32609,Hamlet,57.0,1.1.167,HORATIO,"Whether in sea or fire, in earth or air,",1,1,167,"['MARCELLUS', 'BERNARDO', 'HORATIO']"
32610,Hamlet,57.0,1.1.168,HORATIO,The extravagant and erring spirit hies,1,1,168,"['MARCELLUS', 'BERNARDO', 'HORATIO']"
32611,Hamlet,57.0,1.1.169,HORATIO,To his confine: and of the truth herein,1,1,169,"['MARCELLUS', 'BERNARDO', 'HORATIO']"
32612,Hamlet,57.0,1.1.170,HORATIO,This present object made probation.,1,1,170,"['MARCELLUS', 'BERNARDO', 'HORATIO']"
32613,Hamlet,58.0,1.1.171,MARCELLUS,It faded on the crowing of the cock.,1,1,171,"['MARCELLUS', 'BERNARDO', 'HORATIO']"
32614,Hamlet,58.0,1.1.172,MARCELLUS,Some say that ever 'gainst that season comes,1,1,172,"['MARCELLUS', 'BERNARDO', 'HORATIO']"
32615,Hamlet,58.0,1.1.173,MARCELLUS,"Wherein our Saviour's birth is celebrated,",1,1,173,"['MARCELLUS', 'BERNARDO', 'HORATIO']"
32616,Hamlet,58.0,1.1.174,MARCELLUS,The bird of dawning singeth all night long:,1,1,174,"['MARCELLUS', 'BERNARDO', 'HORATIO']"
32617,Hamlet,58.0,1.1.175,MARCELLUS,"And then, they say, no spirit dares stir abroad,",1,1,175,"['MARCELLUS', 'BERNARDO', 'HORATIO']"
32618,Hamlet,58.0,1.1.176,MARCELLUS,"The nights are wholesome, then no planets strike,",1,1,176,"['MARCELLUS', 'BERNARDO', 'HORATIO']"
32619,Hamlet,58.0,1.1.177,MARCELLUS,"No fairy takes, nor witch hath power to charm,",1,1,177,"['MARCELLUS', 'BERNARDO', 'HORATIO']"
32620,Hamlet,58.0,1.1.178,MARCELLUS,So hallow'd and so gracious is the time.,1,1,178,"['MARCELLUS', 'BERNARDO', 'HORATIO']"
32621,Hamlet,59.0,1.1.179,HORATIO,So have I heard and do in part believe it.,1,1,179,"['MARCELLUS', 'BERNARDO', 'HORATIO']"
32622,Hamlet,59.0,1.1.180,HORATIO,"But, look, the morn, in russet mantle clad,",1,1,180,"['MARCELLUS', 'BERNARDO', 'HORATIO']"
32623,Hamlet,59.0,1.1.181,HORATIO,Walks o'er the dew of yon high eastward hill:,1,1,181,"['MARCELLUS', 'BERNARDO', 'HORATIO']"
32624,Hamlet,59.0,1.1.182,HORATIO,"Break we our watch up, and by my advice,",1,1,182,"['MARCELLUS', 'BERNARDO', 'HORATIO']"
32625,Hamlet,59.0,1.1.183,HORATIO,Let us impart what we have seen to-night,1,1,183,"['MARCELLUS', 'BERNARDO', 'HORATIO']"
32626,Hamlet,59.0,1.1.184,HORATIO,"Unto young Hamlet, for, upon my life,",1,1,184,"['MARCELLUS', 'BERNARDO', 'HORATIO']"
32627,Hamlet,59.0,1.1.185,HORATIO,"This spirit, dumb to us, will speak to him.",1,1,185,"['MARCELLUS', 'BERNARDO', 'HORATIO']"
32628,Hamlet,59.0,1.1.186,HORATIO,"Do you consent we shall acquaint him with it,",1,1,186,"['MARCELLUS', 'BERNARDO', 'HORATIO']"
32629,Hamlet,59.0,1.1.187,HORATIO,"As needful in our loves, fitting our duty?",1,1,187,"['MARCELLUS', 'BERNARDO', 'HORATIO']"
32630,Hamlet,60.0,1.1.188,MARCELLUS,"Let's do't, I pray, and I this morning know",1,1,188,"['MARCELLUS', 'BERNARDO', 'HORATIO']"
32631,Hamlet,60.0,1.1.189,MARCELLUS,Where we shall find him most conveniently.,1,1,189,"['MARCELLUS', 'BERNARDO', 'HORATIO']"
32635,Hamlet,1.0,1.2.1,KING CLAUDIUS,Though yet of Hamlet our dear brother's death,1,2,1,"['KING CLAUDIUS', 'Attendants', 'VOLTIMAND', 'POLONIUS', 'CORNELIUS', 'QUEEN GERTRUDE', 'HAMLET', 'LAERTES', 'Lords']"
32636,Hamlet,1.0,1.2.2,KING CLAUDIUS,"The memory be green, and that it us befitted",1,2,2,"['KING CLAUDIUS', 'Attendants', 'VOLTIMAND', 'POLONIUS', 'CORNELIUS', 'QUEEN GERTRUDE', 'HAMLET', 'LAERTES', 'Lords']"
32637,Hamlet,1.0,1.2.3,KING CLAUDIUS,To bear our hearts in grief and our whole kingdom,1,2,3,"['KING CLAUDIUS', 'Attendants', 'VOLTIMAND', 'POLONIUS', 'CORNELIUS', 'QUEEN GERTRUDE', 'HAMLET', 'LAERTES', 'Lords']"
32638,Hamlet,1.0,1.2.4,KING CLAUDIUS,"To be contracted in one brow of woe,",1,2,4,"['KING CLAUDIUS', 'Attendants', 'VOLTIMAND', 'POLONIUS', 'CORNELIUS', 'QUEEN GERTRUDE', 'HAMLET', 'LAERTES', 'Lords']"
32639,Hamlet,1.0,1.2.5,KING CLAUDIUS,Yet so far hath discretion fought with nature,1,2,5,"['KING CLAUDIUS', 'Attendants', 'VOLTIMAND', 'POLONIUS', 'CORNELIUS', 'QUEEN GERTRUDE', 'HAMLET', 'LAERTES', 'Lords']"
32640,Hamlet,1.0,1.2.6,KING CLAUDIUS,"That we with wisest sorrow think on him,",1,2,6,"['KING CLAUDIUS', 'Attendants', 'VOLTIMAND', 'POLONIUS', 'CORNELIUS', 'QUEEN GERTRUDE', 'HAMLET', 'LAERTES', 'Lords']"
32641,Hamlet,1.0,1.2.7,KING CLAUDIUS,Together with remembrance of ourselves.,1,2,7,"['KING CLAUDIUS', 'Attendants', 'VOLTIMAND', 'POLONIUS', 'CORNELIUS', 'QUEEN GERTRUDE', 'HAMLET', 'LAERTES', 'Lords']"
32642,Hamlet,1.0,1.2.8,KING CLAUDIUS,"Therefore our sometime sister, now our queen,",1,2,8,"['KING CLAUDIUS', 'Attendants', 'VOLTIMAND', 'POLONIUS', 'CORNELIUS', 'QUEEN GERTRUDE', 'HAMLET', 'LAERTES', 'Lords']"
32643,Hamlet,1.0,1.2.9,KING CLAUDIUS,"The imperial jointress to this warlike state,",1,2,9,"['KING CLAUDIUS', 'Attendants', 'VOLTIMAND', 'POLONIUS', 'CORNELIUS', 'QUEEN GERTRUDE', 'HAMLET', 'LAERTES', 'Lords']"
32644,Hamlet,1.0,1.2.10,KING CLAUDIUS,"Have we, as 'twere with a defeated joy,--",1,2,10,"['KING CLAUDIUS', 'Attendants', 'VOLTIMAND', 'POLONIUS', 'CORNELIUS', 'QUEEN GERTRUDE', 'HAMLET', 'LAERTES', 'Lords']"
32645,Hamlet,1.0,1.2.11,KING CLAUDIUS,"With an auspicious and a dropping eye,",1,2,11,"['KING CLAUDIUS', 'Attendants', 'VOLTIMAND', 'POLONIUS', 'CORNELIUS', 'QUEEN GERTRUDE', 'HAMLET', 'LAERTES', 'Lords']"
32646,Hamlet,1.0,1.2.12,KING CLAUDIUS,"With mirth in funeral and with dirge in marriage,",1,2,12,"['KING CLAUDIUS', 'Attendants', 'VOLTIMAND', 'POLONIUS', 'CORNELIUS', 'QUEEN GERTRUDE', 'HAMLET', 'LAERTES', 'Lords']"
32647,Hamlet,1.0,1.2.13,KING CLAUDIUS,"In equal scale weighing delight and dole,--",1,2,13,"['KING CLAUDIUS', 'Attendants', 'VOLTIMAND', 'POLONIUS', 'CORNELIUS', 'QUEEN GERTRUDE', 'HAMLET', 'LAERTES', 'Lords']"
32648,Hamlet,1.0,1.2.14,KING CLAUDIUS,Taken to wife: nor have we herein barr'd,1,2,14,"['KING CLAUDIUS', 'Attendants', 'VOLTIMAND', 'POLONIUS', 'CORNELIUS', 'QUEEN GERTRUDE', 'HAMLET', 'LAERTES', 'Lords']"
32649,Hamlet,1.0,1.2.15,KING CLAUDIUS,"Your better wisdoms, which have freely gone",1,2,15,"['KING CLAUDIUS', 'Attendants', 'VOLTIMAND', 'POLONIUS', 'CORNELIUS', 'QUEEN GERTRUDE', 'HAMLET', 'LAERTES', 'Lords']"
