Dataline,Play,PlayerLinenumber,ActSceneLine,Player,PlayerLine,Act,Scene,Line,Characters
33512,Hamlet,37.0,2.1.125,LORD POLONIUS,"By heaven, it is as proper to our age",2,1,125,"['OPHELIA', 'POLONIUS']"
33513,Hamlet,37.0,2.1.126,LORD POLONIUS,To cast beyond ourselves in our opinions,2,1,126,"['OPHELIA', 'POLONIUS']"
33514,Hamlet,37.0,2.1.127,LORD POLONIUS,As it is common for the younger sort,2,1,127,"['OPHELIA', 'POLONIUS']"
33515,Hamlet,37.0,2.1.128,LORD POLONIUS,"To lack discretion. Come, go we to the king:",2,1,128,"['OPHELIA', 'POLONIUS']"
33516,Hamlet,37.0,2.1.129,LORD POLONIUS,"This must be known, which, being kept close, might",2,1,129,"['OPHELIA', 'POLONIUS']"
33517,Hamlet,37.0,2.1.130,LORD POLONIUS,move,2,1,130,"['OPHELIA', 'POLONIUS']"
33518,Hamlet,37.0,2.1.131,LORD POLONIUS,More grief to hide than hate to utter love.,2,1,131,"['OPHELIA', 'POLONIUS']"
33522,Hamlet,1.0,2.2.1,KING CLAUDIUS,"Welcome, dear Rosencrantz and Guildenstern!",2,2,1,"['KING CLAUDIUS', 'Attendants', 'ROSENCRANTZ', 'QUEEN GERTRUDE', 'GUILDENSTERN']"
33523,Hamlet,1.0,2.2.2,KING CLAUDIUS,"Moreover that we much did long to see you,",2,2,2,"['KING CLAUDIUS', 'Attendants', 'ROSENCRANTZ', 'QUEEN GERTRUDE', 'GUILDENSTERN']"
33524,Hamlet,1.0,2.2.3,KING CLAUDIUS,The need we have to use you did provoke,2,2,3,"['KING CLAUDIUS', 'Attendants', 'ROSENCRANTZ', 'QUEEN GERTRUDE', 'GUILDENSTERN']"
33525,Hamlet,1.0,2.2.4,KING CLAUDIUS,Our hasty sending. Something have you heard,2,2,4,"['KING CLAUDIUS', 'Attendants', 'ROSENCRANTZ', 'QUEEN GERTRUDE', 'GUILDENSTERN']"
33526,Hamlet,1.0,2.2.5,KING CLAUDIUS,"Of Hamlet's transformation, so call it,",2,2,5,"['KING CLAUDIUS', 'Attendants', 'ROSENCRANTZ', 'QUEEN GERTRUDE', 'GUILDENSTERN']"
33527,Hamlet,1.0,2.2.6,KING CLAUDIUS,Sith nor the exterior nor the inward man,2,2,6,"['KING CLAUDIUS', 'Attendants', 'ROSENCRANTZ', 'QUEEN GERTRUDE', 'GUILDENSTERN']"
33528,Hamlet,1.0,2.2.7,KING CLAUDIUS,"Resembles that it was. What it should be,",2,2,7,"['KING CLAUDIUS', 'Attendants', 'ROSENCRANTZ', 'QUEEN GERTRUDE', 'GUILDENSTERN']"
33529,Hamlet,1.0,2.2.8,KING CLAUDIUS,"More than his father's death, that thus hath put him",2,2,8,"['KING CLAUDIUS', 'Attendants', 'ROSENCRANTZ', 'QUEEN GERTRUDE', 'GUILDENSTERN']"
33530,Hamlet,1.0,2.2.9,KING CLAUDIUS,"So much from the understanding of himself,",2,2,9,"['KING CLAUDIUS', 'Attendants', 'ROSENCRANTZ', 'QUEEN GERTRUDE', 'GUILDENSTERN']"
33531,Hamlet,1.0,2.2.10,KING CLAUDIUS,"I cannot dream of: I entreat you both,",2,2,10,"['KING CLAUDIUS', 'Attendants', 'ROSENCRANTZ', 'QUEEN GERTRUDE', 'GUILDENSTERN']"
33532,Hamlet,1.0,2.2.11,KING CLAUDIUS,"That, being of so young days brought up with him,",2,2,11,"['KING CLAUDIUS', 'Attendants', 'ROSENCRANTZ', 'QUEEN GERTRUDE', 'GUILDENSTERN']"
33533,Hamlet,1.0,2.2.12,KING CLAUDIUS,"And sith so neighbour'd to his youth and havior,",2,2,12,"['KING CLAUDIUS', 'Attendants', 'ROSENCRANTZ', 'QUEEN GERTRUDE', 'GUILDENSTERN']"
33534,Hamlet,1.0,2.2.13,KING CLAUDIUS,That you vouchsafe your rest here in our court,2,2,13,"['KING CLAUDIUS', 'Attendants', 'ROSENCRANTZ', 'QUEEN GERTRUDE', 'GUILDENSTERN']"
33535,Hamlet,1.0,2.2.14,KING CLAUDIUS,Some little time: so by your companies,2,2,14,"['KING CLAUDIUS', 'Attendants', 'ROSENCRANTZ', 'QUEEN GERTRUDE', 'GUILDENSTERN']"
33536,Hamlet,1.0,2.2.15,KING CLAUDIUS,"To draw him on to pleasures, and to gather,",2,2,15,"['KING CLAUDIUS', 'Attendants', 'ROSENCRANTZ', 'QUEEN GERTRUDE', 'GUILDENSTERN']"
33537,Hamlet,1.0,2.2.16,KING CLAUDIUS,"So much as from occasion you may glean,",2,2,16,"['KING CLAUDIUS', 'Attendants', 'ROSENCRANTZ', 'QUEEN GERTRUDE', 'GUILDENSTERN']"
33538,Hamlet,1.0,2.2.17,KING CLAUDIUS,"Whether aught, to us unknown, afflicts him thus,",2,2,17,"['KING CLAUDIUS', 'Attendants', 'ROSENCRANTZ', 'QUEEN GERTRUDE', 'GUILDENSTERN']"
33539,Hamlet,1.0,2.2.18,KING CLAUDIUS,"That, open'd, lies within our remedy.",2,2,18,"['KING CLAUDIUS', 'Attendants', 'ROSENCRANTZ', 'QUEEN GERTRUDE', 'GUILDENSTERN']"
33540,Hamlet,2.0,2.2.19,QUEEN GERTRUDE,"Good gentlemen, he hath much talk'd of you,",2,2,19,"['KING CLAUDIUS', 'Attendants', 'ROSENCRANTZ', 'QUEEN GERTRUDE', 'GUILDENSTERN']"
33541,Hamlet,2.0,2.2.20,QUEEN GERTRUDE,And sure I am two men there are not living,2,2,20,"['KING CLAUDIUS', 'Attendants', 'ROSENCRANTZ', 'QUEEN GERTRUDE', 'GUILDENSTERN']"
33542,Hamlet,2.0,2.2.21,QUEEN GERTRUDE,To whom he more adheres. If it will please you,2,2,21,"['KING CLAUDIUS', 'Attendants', 'ROSENCRANTZ', 'QUEEN GERTRUDE', 'GUILDENSTERN']"
33543,Hamlet,2.0,2.2.22,QUEEN GERTRUDE,To show us so much gentry and good will,2,2,22,"['KING CLAUDIUS', 'Attendants', 'ROSENCRANTZ', 'QUEEN GERTRUDE', 'GUILDENSTERN']"
33544,Hamlet,2.0,2.2.23,QUEEN GERTRUDE,"As to expend your time with us awhile,",2,2,23,"['KING CLAUDIUS', 'Attendants', 'ROSENCRANTZ', 'QUEEN GERTRUDE', 'GUILDENSTERN']"
33545,Hamlet,2.0,2.2.24,QUEEN GERTRUDE,"For the supply and profit of our hope,",2,2,24,"['KING CLAUDIUS', 'Attendants', 'ROSENCRANTZ', 'QUEEN GERTRUDE', 'GUILDENSTERN']"
33546,Hamlet,2.0,2.2.25,QUEEN GERTRUDE,Your visitation shall receive such thanks,2,2,25,"['KING CLAUDIUS', 'Attendants', 'ROSENCRANTZ', 'QUEEN GERTRUDE', 'GUILDENSTERN']"
33547,Hamlet,2.0,2.2.26,QUEEN GERTRUDE,As fits a king's remembrance.,2,2,26,"['KING CLAUDIUS', 'Attendants', 'ROSENCRANTZ', 'QUEEN GERTRUDE', 'GUILDENSTERN']"
33548,Hamlet,3.0,2.2.27,ROSENCRANTZ,Both your majesties,2,2,27,"['KING CLAUDIUS', 'Attendants', 'ROSENCRANTZ', 'QUEEN GERTRUDE', 'GUILDENSTERN']"
33549,Hamlet,3.0,2.2.28,ROSENCRANTZ,"Might, by the sovereign power you have of us,",2,2,28,"['KING CLAUDIUS', 'Attendants', 'ROSENCRANTZ', 'QUEEN GERTRUDE', 'GUILDENSTERN']"
33550,Hamlet,3.0,2.2.29,ROSENCRANTZ,Put your dread pleasures more into command,2,2,29,"['KING CLAUDIUS', 'Attendants', 'ROSENCRANTZ', 'QUEEN GERTRUDE', 'GUILDENSTERN']"
33551,Hamlet,3.0,2.2.30,ROSENCRANTZ,Than to entreaty.,2,2,30,"['KING CLAUDIUS', 'Attendants', 'ROSENCRANTZ', 'QUEEN GERTRUDE', 'GUILDENSTERN']"
33552,Hamlet,4.0,2.2.31,GUILDENSTERN,"But we both obey,",2,2,31,"['KING CLAUDIUS', 'Attendants', 'ROSENCRANTZ', 'QUEEN GERTRUDE', 'GUILDENSTERN']"
33553,Hamlet,4.0,2.2.32,GUILDENSTERN,"And here give up ourselves, in the full bent",2,2,32,"['KING CLAUDIUS', 'Attendants', 'ROSENCRANTZ', 'QUEEN GERTRUDE', 'GUILDENSTERN']"
33554,Hamlet,4.0,2.2.33,GUILDENSTERN,"To lay our service freely at your feet,",2,2,33,"['KING CLAUDIUS', 'Attendants', 'ROSENCRANTZ', 'QUEEN GERTRUDE', 'GUILDENSTERN']"
33555,Hamlet,4.0,2.2.34,GUILDENSTERN,To be commanded.,2,2,34,"['KING CLAUDIUS', 'Attendants', 'ROSENCRANTZ', 'QUEEN GERTRUDE', 'GUILDENSTERN']"
33556,Hamlet,5.0,2.2.35,KING CLAUDIUS,"Thanks, Rosencrantz and gentle Guildenstern.",2,2,35,"['KING CLAUDIUS', 'Attendants', 'ROSENCRANTZ', 'QUEEN GERTRUDE', 'GUILDENSTERN']"
33557,Hamlet,6.0,2.2.36,QUEEN GERTRUDE,"Thanks, Guildenstern and gentle Rosencrantz:",2,2,36,"['KING CLAUDIUS', 'Attendants', 'ROSENCRANTZ', 'QUEEN GERTRUDE', 'GUILDENSTERN']"
33558,Hamlet,6.0,2.2.37,QUEEN GERTRUDE,And I beseech you instantly to visit,2,2,37,"['KING CLAUDIUS', 'Attendants', 'ROSENCRANTZ', 'QUEEN GERTRUDE', 'GUILDENSTERN']"
33559,Hamlet,6.0,2.2.38,QUEEN GERTRUDE,"My too much changed son. Go, some of you,",2,2,38,"['KING CLAUDIUS', 'Attendants', 'ROSENCRANTZ', 'QUEEN GERTRUDE', 'GUILDENSTERN']"
33560,Hamlet,6.0,2.2.39,QUEEN GERTRUDE,And bring these gentlemen where Hamlet is.,2,2,39,"['KING CLAUDIUS', 'Attendants', 'ROSENCRANTZ', 'QUEEN GERTRUDE', 'GUILDENSTERN']"
33561,Hamlet,7.0,2.2.40,GUILDENSTERN,Heavens make our presence and our practises,2,2,40,"['KING CLAUDIUS', 'Attendants', 'ROSENCRANTZ', 'QUEEN GERTRUDE', 'GUILDENSTERN']"
33562,Hamlet,7.0,2.2.41,GUILDENSTERN,Pleasant and helpful to him!,2,2,41,"['KING CLAUDIUS', 'Attendants', 'ROSENCRANTZ', 'QUEEN GERTRUDE', 'GUILDENSTERN']"
33563,Hamlet,8.0,2.2.42,QUEEN GERTRUDE,"Ay, amen!",2,2,42,"['KING CLAUDIUS', 'Attendants', 'ROSENCRANTZ', 'QUEEN GERTRUDE', 'GUILDENSTERN']"
33566,Hamlet,9.0,2.2.43,LORD POLONIUS,"The ambassadors from Norway, my good lord,",2,2,43,"['KING CLAUDIUS', 'POLONIUS', 'QUEEN GERTRUDE']"
33567,Hamlet,9.0,2.2.44,LORD POLONIUS,Are joyfully return'd.,2,2,44,"['KING CLAUDIUS', 'POLONIUS', 'QUEEN GERTRUDE']"
33568,Hamlet,10.0,2.2.45,KING CLAUDIUS,Thou still hast been the father of good news.,2,2,45,"['KING CLAUDIUS', 'POLONIUS', 'QUEEN GERTRUDE']"
33569,Hamlet,11.0,2.2.46,LORD POLONIUS,"Have I, my lord? I assure my good liege,",2,2,46,"['KING CLAUDIUS', 'POLONIUS', 'QUEEN GERTRUDE']"
33570,Hamlet,11.0,2.2.47,LORD POLONIUS,"I hold my duty, as I hold my soul,",2,2,47,"['KING CLAUDIUS', 'POLONIUS', 'QUEEN GERTRUDE']"
33571,Hamlet,11.0,2.2.48,LORD POLONIUS,Both to my God and to my gracious king:,2,2,48,"['KING CLAUDIUS', 'POLONIUS', 'QUEEN GERTRUDE']"
33572,Hamlet,11.0,2.2.49,LORD POLONIUS,"And I do think, or else this brain of mine",2,2,49,"['KING CLAUDIUS', 'POLONIUS', 'QUEEN GERTRUDE']"
33573,Hamlet,11.0,2.2.50,LORD POLONIUS,Hunts not the trail of policy so sure,2,2,50,"['KING CLAUDIUS', 'POLONIUS', 'QUEEN GERTRUDE']"
33574,Hamlet,11.0,2.2.51,LORD POLONIUS,"As it hath used to do, that I have found",2,2,51,"['KING CLAUDIUS', 'POLONIUS', 'QUEEN GERTRUDE']"
33575,Hamlet,11.0,2.2.52,LORD POLONIUS,The very cause of Hamlet's lunacy.,2,2,52,"['KING CLAUDIUS', 'POLONIUS', 'QUEEN GERTRUDE']"
33576,Hamlet,12.0,2.2.53,KING CLAUDIUS,"O, speak of that, that do I long to hear.",2,2,53,"['KING CLAUDIUS', 'POLONIUS', 'QUEEN GERTRUDE']"
33577,Hamlet,13.0,2.2.54,LORD POLONIUS,"Give first admittance to the ambassadors,",2,2,54,"['KING CLAUDIUS', 'POLONIUS', 'QUEEN GERTRUDE']"
33578,Hamlet,13.0,2.2.55,LORD POLONIUS,My news shall be the fruit to that great feast.,2,2,55,"['KING CLAUDIUS', 'POLONIUS', 'QUEEN GERTRUDE']"
33579,Hamlet,14.0,2.2.56,KING CLAUDIUS,"Thyself do grace to them, and bring them in.",2,2,56,"['KING CLAUDIUS', 'POLONIUS', 'QUEEN GERTRUDE']"
33581,Hamlet,14.0,2.2.57,KING CLAUDIUS,"He tells me, my dear Gertrude, he hath found",2,2,57,"['KING CLAUDIUS', 'QUEEN GERTRUDE']"
33582,Hamlet,14.0,2.2.58,KING CLAUDIUS,The head and source of all your son's distemper.,2,2,58,"['KING CLAUDIUS', 'QUEEN GERTRUDE']"
33583,Hamlet,15.0,2.2.59,QUEEN GERTRUDE,"I doubt it is no other but the main,",2,2,59,"['KING CLAUDIUS', 'QUEEN GERTRUDE']"
33584,Hamlet,15.0,2.2.60,QUEEN GERTRUDE,"His father's death, and our o'erhasty marriage.",2,2,60,"['KING CLAUDIUS', 'QUEEN GERTRUDE']"
33585,Hamlet,16.0,2.2.61,KING CLAUDIUS,"Well, we shall sift him.",2,2,61,"['KING CLAUDIUS', 'QUEEN GERTRUDE']"
33587,Hamlet,16.0,2.2.62,KING CLAUDIUS,"Welcome, my good friends!",2,2,62,"['KING CLAUDIUS', 'VOLTIMAND', 'POLONIUS', 'CORNELIUS', 'QUEEN GERTRUDE']"
33588,Hamlet,16.0,2.2.63,KING CLAUDIUS,"Say, Voltimand, what from our brother Norway?",2,2,63,"['KING CLAUDIUS', 'VOLTIMAND', 'POLONIUS', 'CORNELIUS', 'QUEEN GERTRUDE']"
33589,Hamlet,17.0,2.2.64,VOLTIMAND,Most fair return of greetings and desires.,2,2,64,"['KING CLAUDIUS', 'VOLTIMAND', 'POLONIUS', 'CORNELIUS', 'QUEEN GERTRUDE']"
33590,Hamlet,17.0,2.2.65,VOLTIMAND,"Upon our first, he sent out to suppress",2,2,65,"['KING CLAUDIUS', 'VOLTIMAND', 'POLONIUS', 'CORNELIUS', 'QUEEN GERTRUDE']"
33591,Hamlet,17.0,2.2.66,VOLTIMAND,"His nephew's levies, which to him appear'd",2,2,66,"['KING CLAUDIUS', 'VOLTIMAND', 'POLONIUS', 'CORNELIUS', 'QUEEN GERTRUDE']"
33592,Hamlet,17.0,2.2.67,VOLTIMAND,"To be a preparation 'gainst the Polack,",2,2,67,"['KING CLAUDIUS', 'VOLTIMAND', 'POLONIUS', 'CORNELIUS', 'QUEEN GERTRUDE']"
33593,Hamlet,17.0,2.2.68,VOLTIMAND,"But, better look'd into, he truly found",2,2,68,"['KING CLAUDIUS', 'VOLTIMAND', 'POLONIUS', 'CORNELIUS', 'QUEEN GERTRUDE']"
33594,Hamlet,17.0,2.2.69,VOLTIMAND,"It was against your highness: whereat grieved,",2,2,69,"['KING CLAUDIUS', 'VOLTIMAND', 'POLONIUS', 'CORNELIUS', 'QUEEN GERTRUDE']"
33595,Hamlet,17.0,2.2.70,VOLTIMAND,"That so his sickness, age and impotence",2,2,70,"['KING CLAUDIUS', 'VOLTIMAND', 'POLONIUS', 'CORNELIUS', 'QUEEN GERTRUDE']"
33596,Hamlet,17.0,2.2.71,VOLTIMAND,"Was falsely borne in hand, sends out arrests",2,2,71,"['KING CLAUDIUS', 'VOLTIMAND', 'POLONIUS', 'CORNELIUS', 'QUEEN GERTRUDE']"
33597,Hamlet,17.0,2.2.72,VOLTIMAND,"On Fortinbras, which he, in brief, obeys,",2,2,72,"['KING CLAUDIUS', 'VOLTIMAND', 'POLONIUS', 'CORNELIUS', 'QUEEN GERTRUDE']"
33598,Hamlet,17.0,2.2.73,VOLTIMAND,"Receives rebuke from Norway, and in fine",2,2,73,"['KING CLAUDIUS', 'VOLTIMAND', 'POLONIUS', 'CORNELIUS', 'QUEEN GERTRUDE']"
33599,Hamlet,17.0,2.2.74,VOLTIMAND,Makes vow before his uncle never more,2,2,74,"['KING CLAUDIUS', 'VOLTIMAND', 'POLONIUS', 'CORNELIUS', 'QUEEN GERTRUDE']"
33600,Hamlet,17.0,2.2.75,VOLTIMAND,To give the assay of arms against your majesty.,2,2,75,"['KING CLAUDIUS', 'VOLTIMAND', 'POLONIUS', 'CORNELIUS', 'QUEEN GERTRUDE']"
33601,Hamlet,17.0,2.2.76,VOLTIMAND,"Whereon old Norway, overcome with joy,",2,2,76,"['KING CLAUDIUS', 'VOLTIMAND', 'POLONIUS', 'CORNELIUS', 'QUEEN GERTRUDE']"
33602,Hamlet,17.0,2.2.77,VOLTIMAND,"Gives him three thousand crowns in annual fee,",2,2,77,"['KING CLAUDIUS', 'VOLTIMAND', 'POLONIUS', 'CORNELIUS', 'QUEEN GERTRUDE']"
33603,Hamlet,17.0,2.2.78,VOLTIMAND,"And his commission to employ those soldiers,",2,2,78,"['KING CLAUDIUS', 'VOLTIMAND', 'POLONIUS', 'CORNELIUS', 'QUEEN GERTRUDE']"
33604,Hamlet,17.0,2.2.79,VOLTIMAND,"So levied as before, against the Polack:",2,2,79,"['KING CLAUDIUS', 'VOLTIMAND', 'POLONIUS', 'CORNELIUS', 'QUEEN GERTRUDE']"
33605,Hamlet,17.0,2.2.80,VOLTIMAND,"With an entreaty, herein further shown,",2,2,80,"['KING CLAUDIUS', 'VOLTIMAND', 'POLONIUS', 'CORNELIUS', 'QUEEN GERTRUDE']"
33607,Hamlet,17.0,2.2.81,VOLTIMAND,That it might please you to give quiet pass,2,2,81,"['KING CLAUDIUS', 'VOLTIMAND', 'POLONIUS', 'CORNELIUS', 'QUEEN GERTRUDE']"
33608,Hamlet,17.0,2.2.82,VOLTIMAND,"Through your dominions for this enterprise,",2,2,82,"['KING CLAUDIUS', 'VOLTIMAND', 'POLONIUS', 'CORNELIUS', 'QUEEN GERTRUDE']"
33609,Hamlet,17.0,2.2.83,VOLTIMAND,On such regards of safety and allowance,2,2,83,"['KING CLAUDIUS', 'VOLTIMAND', 'POLONIUS', 'CORNELIUS', 'QUEEN GERTRUDE']"
33610,Hamlet,17.0,2.2.84,VOLTIMAND,As therein are set down.,2,2,84,"['KING CLAUDIUS', 'VOLTIMAND', 'POLONIUS', 'CORNELIUS', 'QUEEN GERTRUDE']"
33611,Hamlet,18.0,2.2.85,KING CLAUDIUS,"It likes us well,",2,2,85,"['KING CLAUDIUS', 'VOLTIMAND', 'POLONIUS', 'CORNELIUS', 'QUEEN GERTRUDE']"
33612,Hamlet,18.0,2.2.86,KING CLAUDIUS,"And at our more consider'd time well read,",2,2,86,"['KING CLAUDIUS', 'VOLTIMAND', 'POLONIUS', 'CORNELIUS', 'QUEEN GERTRUDE']"
33613,Hamlet,18.0,2.2.87,KING CLAUDIUS,"Answer, and think upon this business.",2,2,87,"['KING CLAUDIUS', 'VOLTIMAND', 'POLONIUS', 'CORNELIUS', 'QUEEN GERTRUDE']"
33614,Hamlet,18.0,2.2.88,KING CLAUDIUS,Meantime we thank you for your well-took labour:,2,2,88,"['KING CLAUDIUS', 'VOLTIMAND', 'POLONIUS', 'CORNELIUS', 'QUEEN GERTRUDE']"
33615,Hamlet,18.0,2.2.89,KING CLAUDIUS,"Go to your rest, at night we'll feast together:",2,2,89,"['KING CLAUDIUS', 'VOLTIMAND', 'POLONIUS', 'CORNELIUS', 'QUEEN GERTRUDE']"
33616,Hamlet,18.0,2.2.90,KING CLAUDIUS,Most welcome home!,2,2,90,"['KING CLAUDIUS', 'VOLTIMAND', 'POLONIUS', 'CORNELIUS', 'QUEEN GERTRUDE']"
33618,Hamlet,19.0,2.2.91,LORD POLONIUS,This business is well ended.,2,2,91,"['KING CLAUDIUS', 'POLONIUS', 'QUEEN GERTRUDE']"
33619,Hamlet,19.0,2.2.92,LORD POLONIUS,"My liege, and madam, to expostulate",2,2,92,"['KING CLAUDIUS', 'POLONIUS', 'QUEEN GERTRUDE']"
33620,Hamlet,19.0,2.2.93,LORD POLONIUS,"What majesty should be, what duty is,",2,2,93,"['KING CLAUDIUS', 'POLONIUS', 'QUEEN GERTRUDE']"
33621,Hamlet,19.0,2.2.94,LORD POLONIUS,"Why day is day, night night, and time is time,",2,2,94,"['KING CLAUDIUS', 'POLONIUS', 'QUEEN GERTRUDE']"
33622,Hamlet,19.0,2.2.95,LORD POLONIUS,"Were nothing but to waste night, day and time.",2,2,95,"['KING CLAUDIUS', 'POLONIUS', 'QUEEN GERTRUDE']"
33623,Hamlet,19.0,2.2.96,LORD POLONIUS,"Therefore, since brevity is the soul of wit,",2,2,96,"['KING CLAUDIUS', 'POLONIUS', 'QUEEN GERTRUDE']"
33624,Hamlet,19.0,2.2.97,LORD POLONIUS,"And tediousness the limbs and outward flourishes,",2,2,97,"['KING CLAUDIUS', 'POLONIUS', 'QUEEN GERTRUDE']"
33625,Hamlet,19.0,2.2.98,LORD POLONIUS,I will be brief: your noble son is mad:,2,2,98,"['KING CLAUDIUS', 'POLONIUS', 'QUEEN GERTRUDE']"
33626,Hamlet,19.0,2.2.99,LORD POLONIUS,"Mad call I it, for, to define true madness,",2,2,99,"['KING CLAUDIUS', 'POLONIUS', 'QUEEN GERTRUDE']"
33627,Hamlet,19.0,2.2.100,LORD POLONIUS,What is't but to be nothing else but mad?,2,2,100,"['KING CLAUDIUS', 'POLONIUS', 'QUEEN GERTRUDE']"
33628,Hamlet,19.0,2.2.101,LORD POLONIUS,But let that go.,2,2,101,"['KING CLAUDIUS', 'POLONIUS', 'QUEEN GERTRUDE']"
33629,Hamlet,20.0,2.2.102,QUEEN GERTRUDE,"More matter, with less art.",2,2,102,"['KING CLAUDIUS', 'POLONIUS', 'QUEEN GERTRUDE']"
33630,Hamlet,21.0,2.2.103,LORD POLONIUS,"Madam, I swear I use no art at all.",2,2,103,"['KING CLAUDIUS', 'POLONIUS', 'QUEEN GERTRUDE']"
33631,Hamlet,21.0,2.2.104,LORD POLONIUS,"That he is mad, 'tis true: 'tis true 'tis pity,",2,2,104,"['KING CLAUDIUS', 'POLONIUS', 'QUEEN GERTRUDE']"
33632,Hamlet,21.0,2.2.105,LORD POLONIUS,"And pity 'tis 'tis true: a foolish figure,",2,2,105,"['KING CLAUDIUS', 'POLONIUS', 'QUEEN GERTRUDE']"
33633,Hamlet,21.0,2.2.106,LORD POLONIUS,"But farewell it, for I will use no art.",2,2,106,"['KING CLAUDIUS', 'POLONIUS', 'QUEEN GERTRUDE']"
33634,Hamlet,21.0,2.2.107,LORD POLONIUS,"Mad let us grant him, then: and now remains",2,2,107,"['KING CLAUDIUS', 'POLONIUS', 'QUEEN GERTRUDE']"
33635,Hamlet,21.0,2.2.108,LORD POLONIUS,"That we find out the cause of this effect,",2,2,108,"['KING CLAUDIUS', 'POLONIUS', 'QUEEN GERTRUDE']"
33636,Hamlet,21.0,2.2.109,LORD POLONIUS,"Or rather say, the cause of this defect,",2,2,109,"['KING CLAUDIUS', 'POLONIUS', 'QUEEN GERTRUDE']"
33637,Hamlet,21.0,2.2.110,LORD POLONIUS,For this effect defective comes by cause:,2,2,110,"['KING CLAUDIUS', 'POLONIUS', 'QUEEN GERTRUDE']"
33638,Hamlet,21.0,2.2.111,LORD POLONIUS,"Thus it remains, and the remainder thus. Perpend.",2,2,111,"['KING CLAUDIUS', 'POLONIUS', 'QUEEN GERTRUDE']"
33639,Hamlet,21.0,2.2.112,LORD POLONIUS,I have a daughter--have while she is mine--,2,2,112,"['KING CLAUDIUS', 'POLONIUS', 'QUEEN GERTRUDE']"
33640,Hamlet,21.0,2.2.113,LORD POLONIUS,"Who, in her duty and obedience, mark,",2,2,113,"['KING CLAUDIUS', 'POLONIUS', 'QUEEN GERTRUDE']"
33641,Hamlet,21.0,2.2.114,LORD POLONIUS,"Hath given me this: now gather, and surmise.",2,2,114,"['KING CLAUDIUS', 'POLONIUS', 'QUEEN GERTRUDE']"
33643,Hamlet,21.0,2.2.115,LORD POLONIUS,"'To the celestial and my soul's idol, the most",2,2,115,"['KING CLAUDIUS', 'POLONIUS', 'QUEEN GERTRUDE']"
33644,Hamlet,21.0,2.2.116,LORD POLONIUS,"beautified Ophelia,'--",2,2,116,"['KING CLAUDIUS', 'POLONIUS', 'QUEEN GERTRUDE']"
33645,Hamlet,21.0,2.2.117,LORD POLONIUS,"That's an ill phrase, a vile phrase, 'beautified' is",2,2,117,"['KING CLAUDIUS', 'POLONIUS', 'QUEEN GERTRUDE']"
33646,Hamlet,21.0,2.2.118,LORD POLONIUS,a vile phrase: but you shall hear. Thus:,2,2,118,"['KING CLAUDIUS', 'POLONIUS', 'QUEEN GERTRUDE']"
33648,Hamlet,21.0,2.2.119,LORD POLONIUS,"'In her excellent white bosom, these,  and c.'",2,2,119,"['KING CLAUDIUS', 'POLONIUS', 'QUEEN GERTRUDE']"
33649,Hamlet,22.0,2.2.120,QUEEN GERTRUDE,Came this from Hamlet to her?,2,2,120,"['KING CLAUDIUS', 'POLONIUS', 'QUEEN GERTRUDE']"
33650,Hamlet,23.0,2.2.121,LORD POLONIUS,"Good madam, stay awhile, I will be faithful.",2,2,121,"['KING CLAUDIUS', 'POLONIUS', 'QUEEN GERTRUDE']"
33652,Hamlet,23.0,2.2.122,LORD POLONIUS,"'Doubt thou the stars are fire,",2,2,122,"['KING CLAUDIUS', 'POLONIUS', 'QUEEN GERTRUDE']"
33653,Hamlet,23.0,2.2.123,LORD POLONIUS,"Doubt that the sun doth move,",2,2,123,"['KING CLAUDIUS', 'POLONIUS', 'QUEEN GERTRUDE']"
33654,Hamlet,23.0,2.2.124,LORD POLONIUS,"Doubt truth to be a liar,",2,2,124,"['KING CLAUDIUS', 'POLONIUS', 'QUEEN GERTRUDE']"
33655,Hamlet,23.0,2.2.125,LORD POLONIUS,But never doubt I love.,2,2,125,"['KING CLAUDIUS', 'POLONIUS', 'QUEEN GERTRUDE']"
33656,Hamlet,23.0,2.2.126,LORD POLONIUS,"'O dear Ophelia, I am ill at these numbers,",2,2,126,"['KING CLAUDIUS', 'POLONIUS', 'QUEEN GERTRUDE']"
33657,Hamlet,23.0,2.2.127,LORD POLONIUS,I have not art to reckon my groans: but that,2,2,127,"['KING CLAUDIUS', 'POLONIUS', 'QUEEN GERTRUDE']"
33658,Hamlet,23.0,2.2.128,LORD POLONIUS,"I love thee best, O most best, believe it. Adieu.",2,2,128,"['KING CLAUDIUS', 'POLONIUS', 'QUEEN GERTRUDE']"
33659,Hamlet,23.0,2.2.129,LORD POLONIUS,"'Thine evermore most dear lady, whilst",2,2,129,"['KING CLAUDIUS', 'POLONIUS', 'QUEEN GERTRUDE']"
33660,Hamlet,23.0,2.2.130,LORD POLONIUS,"this machine is to him, HAMLET.'",2,2,130,"['KING CLAUDIUS', 'POLONIUS', 'QUEEN GERTRUDE']"
33661,Hamlet,23.0,2.2.131,LORD POLONIUS,"This, in obedience, hath my daughter shown me,",2,2,131,"['KING CLAUDIUS', 'POLONIUS', 'QUEEN GERTRUDE']"
33662,Hamlet,23.0,2.2.132,LORD POLONIUS,"And more above, hath his solicitings,",2,2,132,"['KING CLAUDIUS', 'POLONIUS', 'QUEEN GERTRUDE']"
33663,Hamlet,23.0,2.2.133,LORD POLONIUS,"As they fell out by time, by means and place,",2,2,133,"['KING CLAUDIUS', 'POLONIUS', 'QUEEN GERTRUDE']"
33664,Hamlet,23.0,2.2.134,LORD POLONIUS,All given to mine ear.,2,2,134,"['KING CLAUDIUS', 'POLONIUS', 'QUEEN GERTRUDE']"
33665,Hamlet,24.0,2.2.135,KING CLAUDIUS,But how hath she,2,2,135,"['KING CLAUDIUS', 'POLONIUS', 'QUEEN GERTRUDE']"
33666,Hamlet,24.0,2.2.136,KING CLAUDIUS,Received his love?,2,2,136,"['KING CLAUDIUS', 'POLONIUS', 'QUEEN GERTRUDE']"
33667,Hamlet,25.0,2.2.137,LORD POLONIUS,What do you think of me?,2,2,137,"['KING CLAUDIUS', 'POLONIUS', 'QUEEN GERTRUDE']"
33668,Hamlet,26.0,2.2.138,KING CLAUDIUS,As of a man faithful and honourable.,2,2,138,"['KING CLAUDIUS', 'POLONIUS', 'QUEEN GERTRUDE']"
33669,Hamlet,27.0,2.2.139,LORD POLONIUS,"I would fain prove so. But what might you think,",2,2,139,"['KING CLAUDIUS', 'POLONIUS', 'QUEEN GERTRUDE']"
33670,Hamlet,27.0,2.2.140,LORD POLONIUS,When I had seen this hot love on the wing--,2,2,140,"['KING CLAUDIUS', 'POLONIUS', 'QUEEN GERTRUDE']"
33671,Hamlet,27.0,2.2.141,LORD POLONIUS,"As I perceived it, I must tell you that,",2,2,141,"['KING CLAUDIUS', 'POLONIUS', 'QUEEN GERTRUDE']"
33672,Hamlet,27.0,2.2.142,LORD POLONIUS,"Before my daughter told me--what might you,",2,2,142,"['KING CLAUDIUS', 'POLONIUS', 'QUEEN GERTRUDE']"
33673,Hamlet,27.0,2.2.143,LORD POLONIUS,"Or my dear majesty your queen here, think,",2,2,143,"['KING CLAUDIUS', 'POLONIUS', 'QUEEN GERTRUDE']"
33674,Hamlet,27.0,2.2.144,LORD POLONIUS,"If I had play'd the desk or table-book,",2,2,144,"['KING CLAUDIUS', 'POLONIUS', 'QUEEN GERTRUDE']"
33675,Hamlet,27.0,2.2.145,LORD POLONIUS,"Or given my heart a winking, mute and dumb,",2,2,145,"['KING CLAUDIUS', 'POLONIUS', 'QUEEN GERTRUDE']"
33676,Hamlet,27.0,2.2.146,LORD POLONIUS,"Or look'd upon this love with idle sight,",2,2,146,"['KING CLAUDIUS', 'POLONIUS', 'QUEEN GERTRUDE']"
33677,Hamlet,27.0,2.2.147,LORD POLONIUS,"What might you think? No, I went round to work,",2,2,147,"['KING CLAUDIUS', 'POLONIUS', 'QUEEN GERTRUDE']"
33678,Hamlet,27.0,2.2.148,LORD POLONIUS,And my young mistress thus I did bespeak:,2,2,148,"['KING CLAUDIUS', 'POLONIUS', 'QUEEN GERTRUDE']"
33679,Hamlet,27.0,2.2.149,LORD POLONIUS,"'Lord Hamlet is a prince, out of thy star,",2,2,149,"['KING CLAUDIUS', 'POLONIUS', 'QUEEN GERTRUDE']"
33680,Hamlet,27.0,2.2.150,LORD POLONIUS,"This must not be:' and then I precepts gave her,",2,2,150,"['KING CLAUDIUS', 'POLONIUS', 'QUEEN GERTRUDE']"
33681,Hamlet,27.0,2.2.151,LORD POLONIUS,"That she should lock herself from his resort,",2,2,151,"['KING CLAUDIUS', 'POLONIUS', 'QUEEN GERTRUDE']"
33682,Hamlet,27.0,2.2.152,LORD POLONIUS,"Admit no messengers, receive no tokens.",2,2,152,"['KING CLAUDIUS', 'POLONIUS', 'QUEEN GERTRUDE']"
33683,Hamlet,27.0,2.2.153,LORD POLONIUS,"Which done, she took the fruits of my advice,",2,2,153,"['KING CLAUDIUS', 'POLONIUS', 'QUEEN GERTRUDE']"
33684,Hamlet,27.0,2.2.154,LORD POLONIUS,"And he, repulsed--a short tale to make--",2,2,154,"['KING CLAUDIUS', 'POLONIUS', 'QUEEN GERTRUDE']"
33685,Hamlet,27.0,2.2.155,LORD POLONIUS,"Fell into a sadness, then into a fast,",2,2,155,"['KING CLAUDIUS', 'POLONIUS', 'QUEEN GERTRUDE']"
33686,Hamlet,27.0,2.2.156,LORD POLONIUS,"Thence to a watch, thence into a weakness,",2,2,156,"['KING CLAUDIUS', 'POLONIUS', 'QUEEN GERTRUDE']"
33687,Hamlet,27.0,2.2.157,LORD POLONIUS,"Thence to a lightness, and, by this declension,",2,2,157,"['KING CLAUDIUS', 'POLONIUS', 'QUEEN GERTRUDE']"
33688,Hamlet,27.0,2.2.158,LORD POLONIUS,"Into the madness wherein now he raves,",2,2,158,"['KING CLAUDIUS', 'POLONIUS', 'QUEEN GERTRUDE']"
33689,Hamlet,27.0,2.2.159,LORD POLONIUS,And all we mourn for.,2,2,159,"['KING CLAUDIUS', 'POLONIUS', 'QUEEN GERTRUDE']"
33690,Hamlet,28.0,2.2.160,KING CLAUDIUS,Do you think 'tis this?,2,2,160,"['KING CLAUDIUS', 'POLONIUS', 'QUEEN GERTRUDE']"
33691,Hamlet,29.0,2.2.161,QUEEN GERTRUDE,"It may be, very likely.",2,2,161,"['KING CLAUDIUS', 'POLONIUS', 'QUEEN GERTRUDE']"
33692,Hamlet,30.0,2.2.162,LORD POLONIUS,Hath there been such a time--I'd fain know that--,2,2,162,"['KING CLAUDIUS', 'POLONIUS', 'QUEEN GERTRUDE']"
33693,Hamlet,30.0,2.2.163,LORD POLONIUS,"That I have positively said 'Tis so,'",2,2,163,"['KING CLAUDIUS', 'POLONIUS', 'QUEEN GERTRUDE']"
33694,Hamlet,30.0,2.2.164,LORD POLONIUS,When it proved otherwise?,2,2,164,"['KING CLAUDIUS', 'POLONIUS', 'QUEEN GERTRUDE']"
33695,Hamlet,31.0,2.2.165,KING CLAUDIUS,Not that I know.,2,2,165,"['KING CLAUDIUS', 'POLONIUS', 'QUEEN GERTRUDE']"
33696,Hamlet,32.0,2.2.166,LORD POLONIUS,[Pointing to his head and shoulder],2,2,166,"['KING CLAUDIUS', 'POLONIUS', 'QUEEN GERTRUDE']"
33697,Hamlet,32.0,2.2.167,LORD POLONIUS,"Take this from this, if this be otherwise:",2,2,167,"['KING CLAUDIUS', 'POLONIUS', 'QUEEN GERTRUDE']"
33698,Hamlet,32.0,2.2.168,LORD POLONIUS,"If circumstances lead me, I will find",2,2,168,"['KING CLAUDIUS', 'POLONIUS', 'QUEEN GERTRUDE']"
